Unnamed: 0.1,Unnamed: 0,name,len_img,ad,soothing,moisturizing,skin
139,201,닥터하스킨 미라클아토 하이드로 토너 150ml,2,독자 공법 아로마 오일 제적 라벤더 로스 마리 화장품 사용 유기농 허브 배합 건강 허브 선별 최대한 효능 효과 유효 평가 진행 피부 위해 유해 이기 위해 실험 독자 공법 연구소 직접 아로마 성합 인증 구문 소재지 환경 농어 육성 유기 식품 법률 들다 농립축신 식품부 소관 법롱 시형 규칙 조제 비다 파라 농약 농산물 농약 원료 공식 인증 기준 적합 인증 친환경 인증 받다 라벤더 로즈마리 캐모마일 추출 성분 자체 자연 만들다 어진 화장품 인체 적용 시험 결과 요약 스킨 스킨 미라클 트하 이드 로토 피부 절포 통한 일차 자극 평가 탁터 스킨 의뢰 기관 대전 대다 먹다 번길 대한 피부 과학 연구소 기관 경기도 성남시 분당구 연구 기간 시협 기간 지트 시험 인원 최종 연구 대상자 처치 방법 연구 대상자 선정 선정 기준 부함 제외 기준 해당 연구 대상자 선정 시험 부위 미나 피부 손상 부위 철포 방법 시험 부위 에탄올 시르다 페쇄 점포 보다 영업 비데 의거 허가 의의 소의 부분 인용 미라클 아토 이드 토너 세대 정답 라마 이드 히알루론산 촉촉 원료 손상 소화 위해 이드 사용 사용 미라클 아토 이드 토너 식물 자극 미라클 이드 토너 산뜻 피부결 정돈 해주 허브 꽃수 토너 미라클 아토 이드 에멀전 식물 산뜻하다 수분 형성 매일 매일 달라 데일리 보습 에멀전 미라클 도하 이드 에멀전 미라클 아토 이드 크림 미라클 아토 이드 나디 강력 수분 장벽 건조 피부 로케 케어 해주 수분 채우다 거치다 피부 개선 전문 크림 이드 토너 이드 에멀전 이드 토너 이드 크림 포어 다카포 썬크림 이드 크림 제품 미라클 아토 이드 토너 유효 기간 제조 개월 용량 제조 대한민국 제조 책임 판매업 닥터 스킨 사용 방법 클렌저 화장솜 적당 덜다 눈가 입가 제외 렌저 피부 흡수 면서 발라 줍다 전성 글리세린 에리스 리톨 이드 네이티 레시틴 피토 스테릴 옥틸 도데 라우로 클루 메이트 라벤더 오일 카프 릴릴글 라이 라마 이드 엔피 알란 토인 편백 오일 이드 롤라이 즈드 하이 알루로닉애 씨드 소듬 하이 알루로네이트 소듬아세틸 레이티 드하 알루로네이트 시후 직사 증상 이나 부작용 상처 부위 보관 취급 주의 가다 어린이 당지 보관 직사 광선 피해 보관 품질 보증 기준 보다 제품 공정 거래 위원회 소비자 분쟁해결 기준 의거 상해 드립 소비자 상담 센터,1,1,1
140,202,아이디얼 포맨 시카 플러스 진정토너 200mL,5,고민 탄생 남자 들다 진정 토너 면도 외부 자극 쉬다 민감 해지 피부 가지다 남자 끄다 적임 산뜻 원하다 남자 기름 지지 피부 느끼다 남자 모든 고민 안번메 해결 바쁘다 남자 진정 플러스 진정 토너 주름 개선 미백 기능 화장품 물이 무려 함유 되어다 촉촉하다 진정 시킴 데데 콤플렉스 바이오 워터 데카 소사 미드 피부 진정 보조 성분 밸런스 자극적 이진 피부 자극 테스트 완료 안심 사용 플러스 진정 토너 피부 자극 테스트 완료 인체 피부 일차 자극 시험 결과 시험 기간 허다 대상 대상 시험 기관 피부 과학 연구소 방메 결나 수분 중전 원료 특섬메 산뜻하다 발리 남다 워터 타입 스킨 토너 플러스 진정 토너 확신 진정 토너 수분크림 단계 진정 진정 수분크림,1,1,0
141,204,AHC 허브솔루션 로즈 토너 500ml,1,대용량 토너 부담 케어 허브 솔루션 토너 시리즈 피부 늘다 스킨 케어 피부 고민 따르다 다양 활용 가능 멀다 토너 성비 토너 모공 피지 케어 수분 가득 피부 진정 각질 케어 대용량 멀티 유즈 토너 아끼다 족하 관리 대용량 부담 사용 수분 미스트 양하 활용 가능 멀티 만능 토너 이다 석류나무 추출 건조 인하다 해진 피부 촉촉하다 가꾸다 줍다 로즈마리 추출 피부 수분 증발 차단 주어 건강 편안 피부 선사 내용 제품 성분 설명 이다 성비 토너 피부 고민 따르다 양하 활용 가능 멀티 토너 허브 솔루션 토너 시리즈 피부 가편 안해 데일리 허브 허브 솔루션 허브 솔루션 토너 시리즈 사용 흡토 사용 세안 물기 적당 덜다 얼굴 부드럽다 두드 흡수 줍다 사용 세안 화장솜 적다 부결 방향 드럽다 정돈 줍다 간단 토너 부드럽다 화장솜 적다 수분 공급 이나 진정 필요 부위 가량 올려주다 피부 거나 쿨링 필요 냉장고 보관 사용 효과 케어 가능 사이즈 미스트 용기 넣다 피부 건조 마다 수시 뿌리다 공급 줍다 메이크업 스펀지 파운데이션 토너 적당 량적셔 피부 연출 광채 피부 표현 허브 솔루션 토너 전성 정제 프로방스 장미꽃 글리세린 프로필렌 글라이콜 에탄올 펜틸렌글 라이 사과 석류나무 추다 코치 선인장 열매 추출 추출 로즈마리 글라이콜 프로판 다이올 이지 이드 네이티 캐스터 오일 옥틸 도데 세스 카프 릴릴 글라이콜 로메,1,1,1
142,205,AHC 허브솔루션 알로에베라 토너 500ml,1,대용량 토너 부담 산뜻 촉촉 피부결 케어 허브 솔루션 토너 시리즈 피부 늘다 스킨 케어 스템 피부 고민 따르다 양하 활용 가능 멀티 토너 성비 토너 모공 피지 케어 수분 가득 피부 진정 각질 케어 피부결 정돈 동시 수분 채우다 피부 선사 대용량 멀티 유즈 토너 아끼다 촉촉하다 관리 대용량 부담 사용 부피 미스트 양하 활용 가능 멀티 만능 토너 이다 허브 솔루션 알로 토너 로에베 잎수 함유 민감 피부 토닥토닥 진정 토너 민감 피부 로에베 토너 진정 토너 로에베 외부 환경 의하다 자극 받다 민감 피부 진정 초츠무 꽃씨 추출 건강 들보 들다 피부 관리 성비 토너 피부 고민 따르다 양하 활용 가능 멀티 토너 허브 솔루션 토너 시리즈 피부 편안 해지 데일리 허브 진정 클렌징 허브 솔루션 클렌징폼 허브 솔루션 토너 시리즈 사용 흡토 사용 세안 물기 적당 덜다 얼굴 부드럽다 두드 흡수 줍다 사용 세안 충분 한양 화장솜 적다 피부결 방향 부드럽다 정돈 줍다 간단 토너 공급 이나 진정 필요 부위 가량 올려주다 제거 피부 거나 쿨링 필요 냉장고 보관 사용 효과 케어 가능 데일리 미스트 대가 가능 작다 사이즈 미스트 용기 허브 솔루션 넣다 피부 건조 마다 수시 뿌리다 공급 줍다 메이크업 스펀지 파운데이션 루션 적당 적다 피부 연출 광채 피부 표현 허브 솔루션 로에베 토너 전성 정제 로에베 잎수 글리세린 프로필렌 글라이콜 에탄올 펜틸렌글 오다 펜틸렌글 사과 녹차 추출 자작나무 수액 소듬 하이 알루로네이트 꽃씨 추출 부틸렌 글라이콜 프로판 다이올 이지 이드 네이티 캐스터 오일 옥틸 도데 세스 로메 카프 릴릴 글라이콜 글리 세릴 카프 릴레이 폴리 글루타믹애 씨드 이드 롤라이 즈드 익스 텐신 에틸핵실 글리세린 보머 다이소 이디티에이 페녹시 에탄올 향료,1,1,1
143,207,라끄베르 옴므 리차지 시카 애프터쉐이브 185ml,1,애프터 이브 자외선 노출 쉬다 자극 받다 남성 피부 매일 면도 매일 자극 노출 남성 피부 쉽다 남성 피부 위해 업그레이드 라끄베르 리차 애프터 이브 면도 예민 피부 풍부 빠르다 진정 줍다 민감 남성 피부 피부 자극 테스트 완료 민감성 피부 사용 적합 기관 한국 피부 과학 연구원 기간 인원 감초 유효 성분 조산 자극 받다 피부 보호 도움 줍다 성분 알려지다 병풀 추출 피부 진정 주다 지치다 피부 다독 줍다 탁월 보습 파다 습효 능이 탁월 촉촉 연하 관리 줍다 케어 축하 탄탄 보습 장벽 투명 애프터 이브 사용 세안 이나 면도 옴므 리차 애프터 이브 적당 량취해 얼굴 과목 두드 듯이 발라 줍다 애프터 이브 사용 옴므 리차 에멀전 적당 취하 얼굴 전체 부드럽다 펴다 발라 줍다,1,1,1
144,210,닥터자르트 컨트롤에이 티트리먼트 토너 200ml (티트리 약산성 토너),1,해브앤 비주 컨트롤 에이 트리 먼트 토너 피부 첩포 안전성 평가 시험 시험 기관 대한 피부 과학 연구소 시험 기간 시험 인원 특이 사항 개인,0,0,0
145,215,웰라쥬 리얼 히알루로닉 밀크 필 토너 300ml,13,리얼 히알루로닉 밀크 토너 미세 각질 보습 화장 미백 주름 개선 기능 대용량 인체 동일 히알루론산 완성 데일리 촉촉 미세 리얼 히알루로닉 밀크 토너 미세 각질 케어 용량 높이 가격 내리다 매일 매일 달라 맑다 촉촉하다 피부 경험 용량 도서 대용량 토너 기존 밀크 토너 밀크 토너 리얼 히알루로닉 밀크 토너 진짜 히알루론산 만남 유비 끄다 피브 촉촉 부드럽다 우육 깔다 피부 우유 단백질 산성 타입 각질 제거 피부 유연 인체 동일 민감 피부 보습 효과 영양 공급 히알루론산 사용 가능 자사 화장 발의 시작 아시 조조 맑다 고촉 피부 토너 하나로 아무 좋다 화장품 발라 흡수력 떨다 어진 화장품 흡수력 해하 각질 피부 노폐물 리얼 히알루로닉 밀크 토너 깨끗 피부 바탕 준비 각질 케어 성분 알아보다 효능 효과 각질 제거 미세 각질 제거 보습 서부 조르다 과일 유당 바실 러스 트릭 씨드 발효 추천 피부 건성 피부 민감성 피부 모든 피부 리얼 히알루로닉 밀크 토너 트릭 씨드 오다 가다 바실 러스 발효 가다 함유 되어다 각질 제거 보습 동시 선사 촉매 우육 빛깔 피부 케어 천하 절색 클레오파트라 가다 바이 많다 히알루론산 제대로 쓰다 웰라쥬 루론산 달라 자사 순도 히알루론산 함유 불순 날리다 순수 유효 성분 그대로 트륨 루론 연쇄 상구 정제 공정 끝나다 일반 화장품 웰라쥬 히알루론산 정제 순도 히알루론산 오다 수분 흡수 유지 자사 리얼 히알루로닉 밀크 토너 작다 자극 민감 약산 마일 토너 내지 영양 채우다 노폐물 제거 피부 보습 강화 아쿠아 세라 마이 자극 테스트 완료 피부 의하다 피부 일자 자극 평가 대한 인체 적용 시험 시험 기관 한국 피부 과학 연구원 시험 기간 발표 시험대 성인 집중 케어 세안 내용물 적당 덜다 피부 따다 부드럽다 펴다 발라 두드 흡수 줍다 케어 세안 화장솜 이용 피부결 따르다 부드럽다 아내 듯이 사용 세계 바이오 에스테 기업 이다 바이오 히알루론산 세계 출처 시티 리서치 자료 기준 피부 문적 연구 바이오 에스테 전문 기업 우수 제품 고객 신뢰 바탕 미용 시장 선도 자리 지키다 상의 네트 글로벌 네트워크,1,1,1
146,217,AHC 허브솔루션 레몬 토너 500ml,1,대용량 토너 부담 산뜻 촉촉 피부결 케어 허브 피부 늘다 스킨 케어 스템 다양 피부 고민 따르다 양하 활용 가능 멀티 토너 루션 토너 시리즈 성비 토너 모공 피지 케어 수분 가득 피부 진정 각질 케어 대용량 멀티 유즈 토너 아끼다 족하 관리 대용량 부담 사용 분팩 미스트 양하 활용 가능 멀티 만능 토너 이다 추무 레몬 맑다 건강 피부 케어 줍다 수분 보호 성하 피부 촉촉하다 유지시 줍다 사과 우수 보습 건조 피부 수분감 가득 채우다 줍다 내용 제품 성분 설명 이다 성비 토너 피부 고민 따르다 양하 활용 가능 멀티 토너 허브 솔루션 토너 시리즈 피부 편안 해지 데일리 허브 진정 클렌징 허브 솔루션 클렌징폼 허브 솔루션 토너 시리즈 사용 흡토 사용 세안 물기 적당 덜다 얼굴 부드럽다 두드 흡수 줍다 사용 세안 한양 화장솜 적다 피부결 방향 드럽다 정돈 줍다 간단 토너 부드럽다 화장솜 적다 수분 공급 이나 진정 필요 부위 가량 올려주다 피부 거나 쿨링 필요 냉장고 보관 사용 효과 케어 가능 사이즈 미스트 용기 넣다 피부 건조 마다 수시 뿌리다 공급 줍다 메이크업 스펀지 파운데이션 메이크업 광채 피부 표현 허브 솔루션 레몬 토너 전성 정제 레몬 추출 글리세린 프로필렌 글라이콜 에탄올 펜틸렌 글라이콜 사과 소듬 하이 알루로네이트 라임 추출 커먼 자스민 추출 연꽃 꽃추 추다 프리지어 추출 블루 플래그 아이리스 추출 에델바이스 추출 돈나 백합 비늘 줄기 추출 나팔수선화 추출 장미 추출 부틸렌 글라이콜 프로 다이올 이지 이드 네이티 캐스터 오일 옥틸 도데 세스 로메 글리 세릴 카프 릴레이 폴리 글루타믹애 씨드 에틸핵실 글리세린 보머 다이소 이디티에이 페녹시 에탄올 향료,1,1,1
147,218,AHC 온리 포맨 토너 150ml,1,가다 메다 구매 보이다 부르다 포로 끄페 우미 윙크 배우 페페 공연 대아 호피 들다 버떼 빈번 소마 주다 조표 포고 지호 가다 가다 에센스 토너 로션 줍다 올인원 당스 덜다 얼굴 전체 바르다 두드 에스테,0,0,0
148,219,아벤느 젠틀 토닝 로션 200ml 듀오 기획,1,몰다 만날 온라인 단독 민감 젠틀 토닝 로션 기획 구성 젠틀 토닝 로션 피부 순하다 민감 진정 케어 연속 토너 직접 경험 보다 피부 민감 자극 느끼다 지지 사용 어요 피부 편안 진정 되어다 어요 요즘 마스크 트러블 올라오다 피부 진정 위태 어요 확실 진정 효과 만족 제품 만족 부가 뒤집혔 스킨팩 효과 진정 천재 피부 상쾌 바르다 나다 피부 시원 느낌 계절 내내 모든 스킨 케어 이예 벤느 성인 여성 만족도 조사 아벤느 떼르말 그대로 담다 원함 느끼다 레쉬 가볍다 워터 텍스처 보다 피부 자극 테스트 완료 정제 대신 이벤 온천 함유 피부 진정 자극 완화 효과 선사 아벤느 떼르말 함유 이렇다 추천 쉬다 반응 민감 세안 자극 느끼다 민감 피부 스킨팩 활용 가능 토너 필요 민감 피부 타네 오떼르말 아벤느 피부 과학 은유 더모 코스 야벤느 천수 의학 효능 연구 거치다 건의 부과 학술지 논문 게재 피부 진정 자극 완화 효과 지니다 온천 수로 기반 지속 피부 연구 통해 민감 피부 피부 과학 솔루션 제공 대자연 아벤느 온천 프랑스 세벤느산 기숙 에셔 내리다 빗물 암석 통과 단순 물이 민감 피부 름위 온천 수로 태어나다 써다 쓰다 아벤느 고유 아쿠아 바이옴 건강 피부 리밸런싱 이벤 천수 발견 고유 아쿠아 바이옴 상적 미네랄 함량 피부 진정 회복 자극 완화 건강 피부 리밸런싱 가능 야벤느 이드 테라 주간 놀랍다 피부 변화 민감 피부 가지다 사랑 오다 여개 피부 학술 논문 효과 입증 부과 전문의 베다 이드 라피 통해 건강 피부 변화 경험,1,0,0
149,221,원씽 인진쑥 추출물 토너 150ml,11,필요 비용 걷다 피부 필요 재료 제안 전하 엄선 원료 사용 제품 재료 이외 유해 화학 가물 사용 소비자 들다 권리 응원 소비자 들다 합리 소비 도움 고자 화장품 가격 가다 용기 가격 뉴스 화장품 비싸다 수록 좋다 가격 거품 진실 뉴스 아시아 경제 지다 불하 회장 품값 늘다 예쁘다 용기 만들다 일과 피부 좋다 연예인 들다 돌아가다 필요 화장품 비용 아끼다 줍다 이제 절약 깨끗하다 먹다 필라테스 피부 예쁘다 지다 이다 그르 피부 개선 도움 국내 이다 추출 자극 받다 피부 자외선 노출 이나 급격 피부 온도 변화 이유 발생 피부 모세혈관 탄력 잃다 해지 지속 일어 이다 가운 성질 지니 피부 내다 줍다 맑은 피부 도움 원료 효능 효과 피부 개선 문진 국내 이다 추출 피부 진정 도움 자극 피부 진정 주다 피부 균일 개선 도움 맑은 피부 피부 노폐물 출하 피부 맑다 해주다 피부 개선 비타민 나이아신 미네랄 부하 피부 관리 도움 깨끗하다 재료 국내 이다 이다 추출 국내 재배 이다 사용 중금속 불검 추다 검사 완료 그이 원산지 증명서 중금속 불검 추다 검사 인증 비건 이다 추출 늘다 동물 실험 성분 이다 추출 비건 제품 식물성 원료 사용 제품 만들다 동물성 사용 저자극 약산 피부 무자 안전성 테스트 완료 고찰 결론 마당 컴퍼니 의뢰 이다 추출 대한 피부 안전성 가다 대한 인체 적용 마당 컴퍼니 이다 추출 피부 철포 철포 제거 경과 시험 부위 나타 국제 접촉 부월 연구 칸정 기준 따르다 자극 분듀 피부 결과 정표 따르다 평균 키부 반응 피혈 성인 남녀 대상 수행 궁도 일부 진행 되어다 피협 시작 패치 제거 패치 제거 방문 시험 결과 이다 패치 제거 자극 갈다 지다 평균 피부 반응 늘다 피부 첩포 시험 판정 기준 추출 몰다 피부 무자 안전성 테스트 완료 자연 그대로 담다 안전 효능 위해 학적 보존 제나 가물 유하 이다 추출 사철 추출 부틸렌 글라이콜 현산 다이올 이다 스킨 케어 단계 화장솜 추출 적다 피부결 정돈 거나 미스트 용기 넣다 수시 뿌리다 크림 사용 화장품 스킨 로션 크림 배합 사용 해주 크림 이다 추출 추출 배합 사용 가능 이다 추출 병풀 추출 이다 뜨다 화장솜 추출 적다 집중 케어 필요 부분 이마 분간 처럼 붙다 여주 유통기간 어떻다 소일 개봉 가급 개월 이내 사용 해주 보관 어떻다 하나요 직사 광선 피해 서늘하다 보관 해주 젖다 온도 변화 내용물 영향 주의 어린이 임산부 사용 가능 가요 사용 그린 등급 원료 민감 가다 높다 어린이 피부 테스트 확인 사용 해주 보관 주의 사항 화장품 사용 사용 직사 광선 사용 부위 붉다 반점 부어 오름 가려움증 증상 이나 부작용 전문의 상담 사용 패치 테스트 해주 상처 부위 지다 제해 줄다 보관 취급 주의 사항 어린이 보관 줄다 직사 광선 피해 보관 줄다 사용 마개 닫다 아주 사용 용기 깨끗하다 세척 소독 재판매 의심 대량 구매 주문 건의 사전 통보 취소 처리 사용 줄다 천연 단일 침전 흔들다 어서 사용 줄다,1,0,1
150,222,온그리디언츠 리바이탈라이징 토너 기획 세트(+토너30ml증정),4,징스인스 리바이 라이 토너 이렇다 추천 드리다 칙식 피부 고민 이신 피부 고민 이신 산뜻 촉촉하다 워터 제형 원하다 자극 순하다 제품 원하다 맑다 건강 피부 위해 설계 피부 생기 솔루션 강력 항산화 성분 나니 꽂다 추출 히알루론산 수분 장벽 시스템 워터 제형 토티 피부 강력 항산화 효과 사하 나비 콩꽃 추출 피부 생기 나비 콩꽃 이다 뛰어나다 안토시아닌 성분 되어다 스트레스 불어 넣다 도움 줍다 나비 콩꽃 항산화 다량 함유 블루베리 컨디션 지치다 줍다 블루베리 나비 콩꽃 피부 신화 케어 진심 디언츠 추출 치현 추출 추출 특허 종류 항산화 콤플렉스 성분 약해지다 피부 맑은 생기 사하 줍다 피부 채우다 보습 성분 히알루론산 들르다 저분자 분자 고분자 히알루론산 함유 지치다 피부 강력 보습 효과 선사 대다 고분자 피부 표면 보습 형성 소듬 하이 알루로네이트 크로스 폴리머 끌어당기다 피부 보습 선사 주변 수분 끌어당기다 피부 보습 선사 피부 일차 자극 테스트 완료 피부 과학 연구소 남녀 민감성 피부 대상 일차 자극 테스트 완료 연구소 남녀 쥐더 마코 스메틱 피부 과학 즉각 수분 전하 워터 멀티 유즈 토너 끈적임 피부 빠르다 수분감 사하 워터 제형 멀티 유즈 양하 사용 가능 산뜻 촉촉하다 워터 제형 하늘빛 생기 토너 피부 산뜻하다 스며들다 마르 쉽다 피부 빠르다 촉촉하다 수분 채위 줍다 양하 사용 가능 멀티 유즈 대용량 토너 매일 피부 컨디션 상태 따르다 양하 사용 보다 스킨팩 간편 빠르다 가볍다 각질 제거 예민 보습 영양 공급 피부 진정 광채 화장솜 토너 적정 량덜어 토너 듬북 적신 화장솜 바닥 정량 토너 이마 좋다 피부 바깥 원하다 부위 방향 올리다 피부 스트레스 완화 토너 이렇다 추천 드리다 피부 고민 이신 피부 고민 이신 산뜻 촉족 워터 제형 원하다 자극 순하다 제품 원하다 성분 통해 확인 나비 콩꽃 추출 프로필렌 글라이콜 정제 나이아신 아마이드 메틸 프로판 다이올 글리 세레스 피씨 에이 소스 레이 에틸핵실 글리세린 아데노신 꽃씨 추출 추출 쇠비름 추출 현삼 뿌리 추출 토코 퍼롤 시트 릭애 씨드 파다 폴리 글리 세릴 미리 스테이 유칼립투스 오일 버지니아 세틸에틸 핵사 에이트 카프 릴릭 카프 트라이글리세라이드 에틸핵실팔미 테이 로즈마리 추출 소늄 하이 알루로네이트 바질 추출 추출 트리 카리아 병풀 추출 오이 열매 주출 하이 라이즈 드하 알루 닉애 프로필 라이 모늄 하이 알루로네이트 펜틸렌 글라이콜 하이 알루로네이트 크로스 폴리머 이디티에이 리바이 라이 리바이 라이 리바이 라이 토너 패드 스킨 소프 지속 가능 라이프 위힌 분리 배출 가이드 플라스틱 배출 대다 실링 실링 일반 쓰레기 배출 용기 라벨 라벨 용기 분리 일반 쓰레기 배출 제품 요약 정보 제품 디언츠 리바이 라이 스킨 소프 용량 구성 제품 주요 사양 모든 피부 사용 기한 개봉 개월 개봉 개월 사용 방법 적당 피부 덜다 부드럽다 바르다 충분 흡수 줍다 기능 미백 주름 개선 이중 기능 제조 제조 책임 판매업 단상 별도 표기 대한민국 파워 플레이어 전성 나비 콩꽃 추출 프로필렌 글라이콜 정제 나이아신 아마이드 메틸 프로판 다이올 글리 세레스 피씨 에이 소스 레이 아데노신 소듬 시트 레이 꽃씨 추출 추출 쇠비름 추출 현삼 뿌리 추출 시트 릭애 씨드 파다 폴리 글리 세릴 미리 스테이 유칼립투스 오일 버지니아 품년 틸에틸혁 사다 에이트 카프 릴릭 카프 트라이글리세라이드 에틸핵실팔미 테이 로즈마리 추출 소듬 하이 알루로네이트 페퍼민트 추출 트리 카리아 꽃수 병풀 추출 오이 열매 추출 하이 드롤 라이즈 드하 알루로닉애 씨드 하이 드록시 프로필 라이 모늄 하이 알루로네이트 펜틸렌 글라이콜 소듬 하이 알루 크로스 폴리머 소듬아세틸 레이티 드하 얄루 다이소 이디티에이 사용 화장품 사용 사용 직사 광선 사용 부위 붉다 반점 부어 오름 주의 사항 가려움증 증상 이나 부작용 전문의 상담 상처 부위 사용 자제 보관 취급 주의 사항 어린이 당지 보관 직사 광선 피해 보관 품질 보증 기준 보다 제품 공정 거래 위원회 고시 소비자 분쟁해결 기준 의거 보상 드립 소비자 상담 카카오 플러스 친구 디언츠,1,1,1
151,227,[단독기획] 아누아 어성초 77 수딩 토너 350ml 기획(+화장솜 증정),1,몰리 브영 단독 힌점 기획 한정 기획 몰리 브영 진정 토너 서다 회장 몰다 전체,1,0,0
