Unnamed: 0.1,Unnamed: 0,name,len_img,ad,soothing,moisturizing,skin
45,66,마몽드 레티놀 앰플 토너 250ml,1,레티놀 앰플 토너 놀토 수분 탄력 토너 순수 레티 놀이 피부 탄력 도와주다 보습 안티 에이 앰플 토너 레티놀 토너 담다 마몽드 레티놀 앰플 토너 아침 저녁 쉬다 편하다 레티놀 토너 바꾸다 달라 어요 아모레퍼시픽 레티놀 만들다 아모레퍼시픽 최초 레티놀 토너 레티놀 레티놀 만나다 피부 텐션 바뀌다 피부 원하다 텐션 레터 콜라겐 히알루론산 비타민 유도체 황금비율 수분 순수 레티놀 아모레퍼시픽 지속 레티놀 피부 안전성 연구 통해 평가 독일 순수 성분 배합 최적 수분 탄력 가져오다 저분자 콜라겐 피부 흡수 빠르다 저분자 콜라겐 피부 탄력 코어 성분 콜라겐 공급 줍다 알루론산 신의 끌어당기다 히알루론산 쉽다 피부 보습 부여 비타민 유도체 항산화 효능 비타민 유도체 피부 생기 맑다 세상 사용감 이다 시브 케어 단계 레티놀 각질 정돈 정돈 보습 탄력 촉촉 쓸다 쓸다 피부 기초 공사 완성 광물 성오 폴리 아크릴 아마이드 이미다졸 리디닐 우레아 트리 에탄올 한선 생소 파라 베다 주름 개선 기능 부과 테스트 피부 일차 자극 테스트 완료 편안 데일리 레티놀 메다 매일 아침 저녁 세안 적당 덜다 피부결 따르다 부드럽다 흡수 주다 레티놀 앰플 활용 앰플 스키 스킨 수분 탄력 앰플 에센스 처럼 화장솜 적다 앰플 처럼 용해도 좋다 사용 이내 토너 미스트 메이크업 활용 즉각 수분 영양 메이크업 퍼프 적다 공급 필요 미스트 촉촉 탄력 피부 표현 보습 탄력 원스톱 레티놀 앰플 토너 토너 레티놀 수분 탄력,1,1,1
46,68,[대용량] 나인위시스 비건 하이드라 앰플 토너 500ml,14,크다 차이 보습 지속 압도 비건 이드 플토 토너 성분 용량 강력 토너 보습 비건 이드 앰플 토너 보습 성분 완료 차이 인증 완료 성분 차이 보습 차이 물이 비건 이드 대다 명수 독일 노르 나우 워터 함유 성분 다르다 지속 력도 달라 도적 보습 가다 효과 회시 용후 지나 여성 대상 지다 속력 테스트 진행 시험 기간 관리 번호 지나 비건 이드 빈틈 수분 케어 비건 이드 라만 압도 포인트 보습 지속 완료 성분 차이 비건 인증 완료 인체 적용 시혐 완료 지속 보습 보습 지속 효과 사용 시험 제품 사용 대조군 대비 시험 물리 자극 의하다 피부 진정 효과 대조군 대비 시험 개선 건조 환경 의하다 피부 보습 효과 노출 휴먼 피부 임상시험 센터 여성 대상 지다 속력 테스트 진행 시험 기간 관리 번호 나우 워터 대다 명수 독일 노르 피부 촉촉 강하 달톤 저분자 히알루론산 함유 분자 이루 어져 효과 수분 흡수 유지 상기 내용 원료 피부 자극 테스트 결과 비자 판정 비건 이드 앰플 토너 인체 피부 일차 자극 측면 피부 자극 지수 판정 기준 따르다 비자 제품 판정 피부 시형 센터 프투 사용 세안 적당 화장 취해 눈가 제외 얼굴 전체 부드럽다 발라 흡수 줍다 화장솜 묻히다 토너 좋다 전성 정제 밉다 워터 글리세린 핵산 다이올 부틸렌 크다 라이 틸다 베타 메틸 프로판 다이올 파다 아크 릴레이 알킬 아크릴 레이 크로스 폴리머 에틸렉실 글리세린 로메 다이소 이디티에이 루란 올리다 사카 라이드 소등 하이 알루로네이트 베타 글루칸 말토 덱스트린 인젤 리카 뿌리 추출 삼색 제비 추출 매스틱 이드 롤라이 즈드소듬 하이 알루로네이트 소듬 하이 알루로네이트 크로스 폴리 포타슴 하이 쿠로 이트 하이 드록시 프로필 라이 모늄 하이 알루로네이트 하이 드롤 라이즈 드하 알루로닉애 씨드 하이 알루로닉 씨드 글리 세릴 클루 사이드 펜틸렌클 라이 희다 목이버섯 폴리 사카 라이드 소듬아세틸러 이티 드하 알루로네이트,1,1,1
47,69,[NEW] 바이오힐보 세라뮨 하이드레이팅 크림 스킨 200ml,6,늘다 강의 건조 지다 케어 수분 해결 보습 바이오 이드 레이 크림 스킨 반복 건조 지치다 피부 늘다 부족 하니 끄다 피부 수분 채우다 여전 건조 바르다 촉촉하다 흡수 건조 지다 건조 피부 거치다 고갈 라지 세라문 약해지다 보습 표적 케어 피부 표면 거치다 어진 피부 보습 보습 수분 케어 피부결 개선 장벽 개선 표면 건조 거치다 피부 지나 고촉 실크 처럼 부드럽다 유지 보습 부드럽다 흐르다 실키 마무리 크림 스킨 크림 스킨 사용 제품 사용 제품 사용 제품 사용 피부 보습 피부 끈적임 거치다 피부결 즉각 개선 흡수 부드럽다 이전 실크 촉촉하다 발리 부드럽다 케이피 부임 상연 세다 개인 차다 단계 삐르 건조 피부 개선 바이오 힐보 히알루론산 보습 수분 케어 라마 이드 보습 방어 건성 피부 전하 피부 건강 악화 시그널 건조 각질 수분 함유량 건조 발생 이하 피부 건강 약화 쉬다 건조 느끼다 빠르다 긴급 보습 보습 즉각 개선 사용 후보 개선 초사 용후 즉각 일시 보습 개선 자꾸만 지고 싶다 거치다 피부결 개선 건조 거치다 어진 피부결 건조 조건 노출 사용 직후 사용 사용 직후 건조 거치다 어진 피부 즉각 일시 개선 건조 피부 빠르다 수분 충전 보습 피부 환경 바이오 힐보 독자 세라 마이 펜타 부의 수분 빠르다 채우다 세라 마이 종류 히알루론산 피부 보습 인자 성분 피부 에너지 강화 피토 바이옴 피부 밸런스 추다 주다 식물 유래 기반 프리 프로 포스트 바이오 틱스 바이오 힐보 독자 성분 독자 세라 마이 더욱 확실 효과 보습 방어 원료 세라 마이 드원물 세라 마이 기술 적용 펜타 세라 마이 부드럽다 실키 사용감 구현 적용 세라 마이 일반세 라마 운펜 리마 이드 피부 밀착 제공 체크 안심 사용 대한 피부 피부 타입 화장품 선택 가이드 건성 주의 성분 배제 향료 첨가 안심 사용 전성 자극 지수 건조 피부 촉촉하다 피부 자극 부자 극정 시험 제품 바이오 이드 레이 크림 스킨 무자 극성 사용 매일 아침 저녁 세안 플리 케이 활용 적당 덜다 줍다 부드럽다 펴다 발라 준후 흡수 줍다 세라문 이드 레이 라인 보슴 방어 보습 바이오 힐보 세라문 이드 레이 크림 스킨 별보 바이오 힐보 세라 이드 레이 크림 대다 보습 전문 크림 선문 크림 바이오 세라문 이드 레이 크림,1,1,1
48,70,메이크프렘 인테카 진정 토너 200ml 기획 (+100ml 리필팩+인테카 크림 31ml),9,최대 용량 리필 기획 이다 토너 이다 토너 리필팩 이다 크림 진정 케어 하나로 급속 진정 토너 메이크 프렘 이다 진정 토너 자극 순하다 각질 정돈 이다 진정 토너 스킨 케어 단계 수분 진정 병품 추출 진정 핵심 성분 이다 부르다 즉각 진정 주다 식물 유래 모이 스처 콤플렉스 종이 충분 공급 줍다 자극 받다 피부 빠르다 진정 케어 원하다 산뜻하다 수분 공급 필요 피부 상태 고민 과도 각질 화장 논코메 도제 여드름 피부 개선 타지 진하다 콤플렉스 진정 솔루션 이다 우려 듯이 제수 넣다 유효 성분 주다 해내다 액체 타입 성분 오일 알코올 피부 흡수 미비 테카 특허 공법 피부 흡수력 이다 모공 작다 나노 사이즈 성분 브으 강력 진정 성분 빠르다 피부 전달 사이즈 모공 사이즈 이다 나노 사이즈 일반 화장품 흡수 모공 자가 커서 오일 알코올 표피 주로 머무르다 자다 녹지 특허 적용 피부 흡수 특허 더하다 안정화 나노 사이즈 메이크 프렘 이다 병풀 핵심 성분 피부 전하 전달 줍다 묵다 각질 피지 정돈 자극 케어 천연 각질 분해 식물 유래 묵다 각질 제거 피지 케어 깨끗 매끄럽다 피부결 들어주다 영조 이티 고개 수이 회시 직후 사용 직후 피지 회시 직후 허다 기간 시험대 라티 이즈 과도 각질 케어 피부 민감 해지 막다 위해 각질 의주 성분 케라틴 단백질 집중 분해 녹이다 개념 각질 케어 성분 이다 서해 연안 균종 리해 케라틴 분해능 뛰어나다 최적 주선 특허 등록 번호 각질 상기 내용 원료 특성 붉다 은기 감소 사용 회사 용후 시험 기관 피부 임상시험 센터 시험 기간 시험대 한국 성인 여성 이다 토너 도포 부다 붉다 은기 감소 사용 사용 이다 토너 무도 붉다 은기 감소 붉다 은기 감소 사용 사용 시험 기관 피부 임상시험 센터 사용 피부 속보 개선 효과 이다 토너 사용 이다 토너 사용 시험 기간 시험대 한국 성인 여성 이다 토너 도포 시험 기관 피부 임상시험 센터 시험 기간 시험대 한국 성인 여성 토너 제형 산뜻 촉촉하다 마무리 산뜻 치자 추출 피부 진정 트러블 케어 맥아 추출 스커 보습 탄력 영양 공급 삼색제비꽃 추출 스브너츠 피부 진정 수분 보충 상기 내용 특성 구책 원자 피부 프로토 보다 메이크 프렘 이다 진정 토너 늘다 인체 민감성 피부 일차 자극 측면 저자극 범주 물질 판단 진청 토나 연제 일로 시험 기관 마리 디엠 피부 과학 연구소 시험 기간 시험대 이다 토너 사용 방법 피부결 정돈 필요 피부 진정 수분 공급 필요 적당 덜다 피부 두드 흡수 쌓다 올리다 줄다 정커 가다 화장솜 족하 적다 분가 떼다 내면 피부 진정 효과 사용 마음 클린 뷰티 메이크 프렘 진정 솔루션 병풀 성분 이다 피부 진정 빠르다 강력 사용 마음 클린 뷰티 메이크 프렘 진정 솔루션 병풀 성분 이다 피부 진정 빠르다 강력 보다 제품 메이크 프렘 공식 판매 판매 배송 정품 이다 보다 내용 온라인 사이트 메이크 프렘 정식 공급 계약 맺다 판매 상적 교환 반품 환불 서비스 요청 제약 받다 메이크 프렘 공식 온라인 판매 구입 시기 바라다 당사 상표권 제품 패키지 상서 페이지 모든 컨텐츠 저작권법 보호 받다 무단 이용 배포 경무 사또 형사 상의 책임 부담 부담 다량 구매 재판매 의심 문건 사전 알림 일괄 취소 안내 드립,1,1,1
49,71,[NEW] 브링그린 쑥세라카밍모이스처토너 500mL,11,토너 찾다 보습 배속 라지 민감 피부 진정 세라 토너 만나다 보다 괴물 용량 세라 대용량 토너 배속 빠르다 촉촉 진정 세라 카밍 모이 스처 토너 새롭다 세라 카밍 모이 스처 토너 토너 하나로 피부 갈증 빠르다 세라 끄다 쑥결 사철 라마 이드 만나다 탄생 일반 빠르다 보습 진정 선사 세라 세라 카밍 모이 스처 토너 크림 리페 크림 기존 제품 대비 피부 보습 함량 평가 한국 피부 과학 연구원 개인 원료 특성 빠르다 보습 필요 빠르다 채우다 민감 해지 기존 제품 대비 보습 배속 보습 효과 테스트 완료 대조군 기존 제품 세라 토너 사용 사용 한국 피부 과학 연구원 개인 토너 발라 피부 습량 증가 세안 빠르다 건조 해지 피부 편안 이레 피부 증가 제품 사용 제품 사용 한국 피부 과학 연구원 개인 학연 보습 흐스려 사용감 만족도 한국 피부 과학 연구원 개인 피부 자극 테스트 완료 민감 피부 사용 가능 순하다 저자극 보습 토너 브링 그린 브링 그린 세라 카밍 모이 스처 토너 까다롬 엄격 심사 과정 거치다 이브 비컨 인증 획득 제품 이다 한국 피부 과학 연구원 개인 산성 민감 피부 부담 약산 뮬러 피부 닮다 약산 세라 토너 채우다 민감 진정 보다 건강 피부 원료 특성 사철 추출 정제 프로판 펜틸렌 글라이콜 쇠비름 추출 오다 부틸렌 글라이콜 핵산 다이올 추출 무화과 추출 향기 제비꽃 추출 이드 네이티 레시틴 연필향나무 오일 마카 다미 오일 불가리 스쑥 오일 광곽향 오일 로즈마리 오일 소듬 하이 알루로네이트 글리세린 옥틸 도데 세스 페닐 이메티콘 폴리 글리 세릴 올리다 에이트 보머 로메 다이소 이디티에이 라마 이드 칸디다 봄비 콜라 글루코오스 메틸 레이 프씨 데이트 발효 폴리 글리 세릴 스테 레이 세다 아릴 알코올 늄스 로일 글루타메이트 브링 그린 이유 원료 추출 공법 남다르다 만들다 배속 공법 용매 담다 내다 사철 추출 장하 피부 기르다 플라보노이드 성분 함유 토너 작업 수확 이내 작업 수확 사철 성분 추출 이내 세라 세라 세라 토너 패드 크림 세라 리페 크림,1,1,0
50,72,아벤느 이드랑스 딥 모이스트로션 200ml,1,이드 랑스 이스트 로션 이드 랑스 이스트 로션 사용 피부 변화 편안 피부 부드럽다 피부 조사 사용 보다 여드름 피부 사용 적합 인공 색소 첨가 피부 전문의 독하다 피부 자극 테스트 완료 수분 가득 투명 토너 스킨 케어 시작 단계 수분 케어 피부 정돈 심하다 피부 촉촉하다 부여 정돈 수분 저장 아벤느 독자 기술 수분 쿠션 적용 피부 수분 저장 정제 대신 피부 진정 회복 도움 이벤 온천 함유 아벤느 수분 과학 결정 테크놀로지 수분 가득 금은 스펀지 처럼 야벤느 천수 캡처 피부 수분 채우다 보습 피부 감싸다 수분 저장 줍다 피부 표피 이렇다 아침 건조 느끼다 수분 부족 지성 피부 촉촉 워터 타입 토너 선추 허다 양하다 수분 케어 멀티 활용 토너 고통 받다 아물다 따다 투명 토너 덜다 필수 투명 토너 끈적임 피부 정돈 발라 주다 수분 가득 초크 초크 피부 맑다 해주다 파란 에센스 발라 주다 건조 걱정 어요 느낌 이예 민감 피부 스뜨레스였던 화장품 유목민 정착 작년 통째 쓰다 알다 피부 진정 순하다 촉촉하다 수분 수분 채우다 어서 안되다 인생 사용감 차니 끄다 화장 내돈내산 두고두고 산뜻 계속 가요 놀다 최애 수분 충전 이스트로 강추 더모 코스 야벤느 제안 올바르다 사용 아침 저녁 세안 화장솜 적당 덜다 피부결 따르다 발라 줄다 진하다 촉촉하다 필요 손바닥 덜다 여러 두드 리듯 흡수 발라 주어 좋다 촉촉하다 지키다 아벤느 이드 랑스 자곡 차곡 수분 쌓다 채우다 잠그다 수분 탄탄 수분 밀착 수분 강화 지속 투명 토너 파란 에센스 수분 잠그다 크림 팁모 이스트 로션 에센스 로션 리하 이드 레이 이드 레이 아쿠아 크림 전안 사용 수분 지속 확인 개인 오떼르말아벤느 피부 과학 은유 더모 코스 야벤느 천수 학적 효능 연구 거치다 건의 부과 학술지 논문 게재 완화 효과 지니다 온천 수로 기반 지속 피부 연구 통해 민감 피부 피부 과학 솔루션 제공 대자연 아벤느 온천 프랑스 서번 신기 써다 따다 빗물 암석 통과 순하다 물이 민감 피부 선수 태어나다 아벤느 고유 아쿠아 바이옴 건강 피부 리밸런싱 아벤느온 천수 발견 고유 아쿠아 바이옴 상적 밉다 함량 피부 진정 회복 자극 건강 피부 리밸런심 가능 이드 테라 센터 주간 놀랍다 피부 변화 민감 피부 가다 진사 여개 피부 학술 논문 효과 입증 부과 전문의 야벤느 이드 라피 통해 건강 피부 변화,1,1,1
51,73,바이오힐보 비타민 히알루로닉 앰플토너 150ml,1,닉힐 보가 기반 고기 안티 에이 덥다 스킨 케어 새롭다 리뉴얼 되어다 기존 세라 마이 토너 업그레이드 바이오 비타민 히알루로닉 앰플 토너 상품 설명 구마 정보 소수 비타민 히알루론산 더하다 생기 수분 바탕 앰플 트너 재탄생 거철 어진 피부 생기 탄력 떨다 어진 피부 바이오 일반 비타민 콤플렉스 크다 바이오 멀티 비타민 콤플렉스 미백 붙다 케어 비타 이온 생기 장벽 라이트닝 라이트닝 탄력 영양 공급 진정 유수 밸런스 아스코 빌글루코 사이드 피부 미백 핵심 성분 비타민 포함 비타민 비타민 담다 멀티 비타민 콤플렉스 이다 음이온 피부 양이온 전달 밀착 성질 이용 리포좀 공법 적용 특허 등록 번호 비타민 유효 성분 피부 효과 전달 밝다 환하다 피부 케어 도움 줍다 수분 밀착 루로네이트 레이티 드하 알루로네이트 거치다 피부 세라 마이 드으 보습 장벽 케어 부드럽다 탄력 피부 바탕 완성 어떻다 평가 분감 느껴지다 모든 피부 타입 사용 가능 토너 핑크 피부 타입 복합성 좋다 피부 고민 보습 좋다 자극 자극 순하다 촉촉하다 토너 찾다 신다 추천 겨울 가볍다 토너 이용 면피 부가 많다 토너 용하다 얼굴 가다 고민 엄마 사용 면서 시더 써다 보다 토너 점성 토너 바르다 수분감 지다 토너 바르다 피부 촉촉하다 느끼다 지고 좋다 지성 이신 덜하다 면서 보습 토너 찾다 겨울 사용 좋다 민감성 피부 트러블 따갑다 전혀 모든 피부 타입 사용 토너 오다 뜨다 가다 뜨다 유목민 정착 아이템 재구매의사 금방 펴다 발라 지고 빠르다 피부 타입 지성 좋다 피부 고민 보습 좋다 자극 순하다 토너 유목민 가다 닉힐보 제품 알다 정착 되어다 수분 충전 쓰기 만족 스럽다 엄마 계속 통째 구매 무향 가깝다 제형 끈적임 전혀 금방 펴다 발라 되어다 지성 피부 라서 제품 맞다 피부 트러블 날다 걱정 나다 좋다 구매 의향 피부 타입 건성 좋다 피부 고민 보습 좋다 자극 자극 닉힐보 제품 들다 사용 다가 토너 에멀젼 처음 매하 뒤었 어요 피부 건조 수분감 많다 을지 가제 궁금하다 토너 사용 보다 제형 자체 형태 유지 에멀젼 진하다 강렬 한편 부담 사용 건조 피부 사용 좋다 토너 가성비 정말 정말 좋다 데일리 가성비 갑갑 피부 타입 건성 좋다 피부 고민 보습 좋다 자극 자극 이순 엄마 데일리 토너 이다 저렴 순하다 서너 좋다 보통 토너 쓰다 시기 가성비 따다 지시 제품 넘다 사다 어요 가성비 좋다 고순 좋다 고하 올리브영 온라인 몰다 추다 고객 환하다 빛나다 미백 케어 바이오 비타민 토닝 라인 눈가 다크 스팟 케어 약속 비타 광채 올인원 민토 기미 잡티세럼 에센스 아이크 비타민 히알루론산 비타민 히알루론산 히알루론산 생기 수분 생기 밀착 보습 비타민 바탕 토너 에멀전 비타민 수분크림,1,1,1
52,74,바이오더마 하이드라비오 토너 250ml,3,올리브영 판매 랭킹 신상 랭킹 기획전 이벤트 실시간 랭킹 판매 랭킹 리뷰 베스트 이드 라비 화장솜 증정 올리브영 라인 몰다 더모 판매 랭킹 바이오 덥다 온라인 구매 정품 인증 마크 확인 나오다 스코리아 가다 공식 수입 바이오 덥다 판매 페이지 정품 인증 마크 인증 표시 되어다 마크 판매 페이지 구매 상품 품질 보증 어리다 본사 제공 고객 받다 상세 페이지 무단 도용 적조 강력 대다 제품 로고 디자인 리뉴얼 되어다 안내 드립 리뉴얼 라벨 기존 라벨 되어다 출고 예정 제품 성분 함량 효능 동일 대한민국 대표 브랜드 대상 미드 라비 토너 리얼 리뷰 처음 사고 벌써 년쩌 중이 수부지 오리 부영 후기 바디 케머 분야 리뷰 바르다 바르다 차이 확실 혜성 사용 후기 피부결 정리 덜머 내다 피부결 대다 느낌 화장솜 적당 루기 메이크업 미크 자다 먹다 피부 추기 메이크업 분야 리뷰 이드 라비 토너 구매 후기 기준 개인 저장 장벽 탄하 빈틈 수분 레이어 화제 자일리톨 클리 세린 밉다 함듀되머 꾸다 주어 완성 스보 수분감 피부 자체 기르다 성분 복합 사과 추출 밉다 오다 이드 비다 라인 버크 개념 수분 공급 시스템 피부 수분 활성화 도록 도와주다 피부 수분 통로 건조 피부 돌투돌 청량하다 사용감 평소 쉬다 건조 느끼다 각질 지르다 깔끔하다 워터 타입 수부지 피부 정돈 싶다 진정 토너 필요 정량 사용감 로션 에센스 끈적임 빠르다 산뜻 실키 탄탄 투명 워터 타입 장점 모으다 촉촉하다 흡수 수분 밀착 마무리 사하 마무리 사하 텍스처 워터 타입 텍스처 타입 텍스쳐 타입 텍스처 타입 텍스처 수분 잠그다 속건조 분광 사하 수분 잠그다 시스템 하루 종일 촉촉하다 수분 장벽 강화 토너 수분 밀착 수분 미백 크림 미백 기능 미백 기능 미백 기능 사용 사용권 몰리 브영 수입 더모 토너 브랜드 바이오 덥다 토너 금액 수량 합산 기준 자사 몰다 판매 금액 기준 대상 기기 측정 개인 차다,1,1,1
