Unnamed: 0.1,Unnamed: 0,name,len_img,ad,soothing,moisturizing,skin
93,131,피지오겔 DMT 포맨 에센셜 토너 200ml,2,남성 고객 가장 선택 로션 브랜드 재고 상황 따르다 패키지 상이 제품 배송 내용물 용량 동일 제품 이다 건조 민감 남자 피부 피지 오겔 면도 즉각 수분 공급 에센스 처럼 팍찬 보습 면도 직후 바르다 순하다 저자극 보습 감다 아주 면서 이지 토너 필요 남자 피부 순하다 덥다 코스 제품 찾다 남자 화장품 무향 남자 피부 아보 여성 비다 두껍다 피지 비량 많다 남자 피부 피지 오겔 에센셜 토너 에센스 처럼 보슴감 이면 서도 산뜻하다 마무리 면도 보습 케어 보습 장벽 테스트 완료 민곤 피부 걱정 감송 피부 사용 적합 평가 완료 피지 오겔 에센셜 토너 평가 완료 이씨 코리아 여성 건조 남성 피부 바이오 미믹 테크놀로지 피부 유사 성분 구성 적용 바이오 미믹 기술 히알루론산 더하다 뮬러 남성 피부 저자극 보습 직접 사용 보다 들다 인정 에센셜 토너 만족도 피부 스며들다 느낌 들다 어요 들다 피부결 부드럽다 정돈 느낌 민감 피부 진정 느낌 피부 매끄럽다 느낌 마코 스메틱 피지 모펠 믿다 쓰다 안심 처방 늘다 안심 보습 피부 장벽 테스트 기술 연구원 남녀 민감성 피부 사용 적합 평가 이씨 코리아 여성 논코메 도제 테스트 남녀 하이포 알다 테스트 성인 제품 피지 오겔 데일리 모이 스치다 테라 포맨 페이 토너 내용물 용량 중량 제품 주요 사양 모든 피부 타입 사용 기한 개봉 후사 용기 개월 이내 제조 상품 판매 스킨 케어 단계 적당 취하 얼굴 피부 마사지 줍다 표시 여야 사용 의주 의사 사용 부위 직사 광선 피해 보관 품질 보증 기준 보다 제품 에이 상이 공정 거래 위원회 고시 소비자 분쟁해결 기준 보상 드립 고객 상담 수신 자부,1,1,1
94,132,아이디얼 포맨 퍼펙트 스킨 150ml,3,매출 기준 매출 기준 남성 안티 에이 단계 탄력 부스 스킨 아이디얼 퍼펙트 스킨 주름 개선 미백 기능 화장품 처지다 서하 부각 항목 해나 리도 퍼펙트 스킨 케어 탄력 솔루션 필요 스킨 케어 퍼펙트 탄력 리프 솔루션 남성 피부 대상 입증 완료 진짜 남자 탄력 리프 스킨 케어 눈밑 주름 개선 윤기 개선 눈밑 주름 개선 리프 효과 개선 이마 개선 세다 세다 쓰다 사용 주사 용후 주사 용후 사용 주사 용후 퍼펙트 스킨 로션 사용 퍼펙트 스킨 로션 주사 주름 개선 측정 결과 리프 효과 측정 결과 탄력 개선 효과 건강 피부 피부 윤기 개선 효과 개선 세다 세다 사용 주사 용후 주사 용후 사용 사용 직후 퍼펙트 스킨 로션 사용 탄력 개선 측정 결과 퍼펙트 스킨 로션 사용 피부 윤기 개선 측정 결과 남성 직접 용해 보고 퍼펙 제품 전체 만족 피부 탄력 개선 만족 미니 피부 생기 개선 만족 고기 능성 미지 남성 피부 탄력 마미 디월 포맨 말다 성분 배합 스부 피부 수분 수분 탄력 부스 팀메 주다 스킨 직접 구매 유저 들다 만족 고고 고고 적미 산뜻하다 련빈 기르다 사계절 내내 용해도 뜨다 신랑 써다 보더 밉다 써다,0,0,1
95,133,에스트라 에이시카365 수분진정결토너 250ml,7,부드럽다 먹다 수분 결진 점토 부드럽다 부결 진정 토너 에스 에이 수분 진정 토너 민감 피부 치명 늘다 신가 케어 해주 방법 이해 돕기 내부 간이 실험 결과 이다 민감 피부 지속 강하 점점 예민 각질 피부 보호 막다 로서 무조건 강하 늘다 안되다 화장솜 통해 피부 보호 각질 장벽 물리 자극 계속 가해 지게 되어다 피부 예민 해지 붉다 건조 민감 피부 장하 닭토 피부 민감 해지 닭토 그냥 바르다 기만 피부결 부드럽다 토너 민감 피부 계절 내내 사용 한진 토너 촉촉하다 진정 토너 필요 에스 이렇다 고민 들다 해결 위해 에이 토너 개발 되어다 피부결 정돈 효과 민감 피부 케어 성분 함유 되어다 피부결 정돈 피부 자극 지수 놀랍다 진정 효과 사용 직후 진정 강력 진정 토너 화성 함유 되어다 피부 편안 토대 속수 달다 토너 수분 촉촉하다 채우다 수분 가득 토너 약산 개포 뮬러 세안 가밸런싱 효과 무너지다 피부 맞추다 약산 토너 부드럽다 피부결 정돈 효과 민감 피부 기존 고민 화장솜 이용 사용 피부 감고 예민 지다 에이 토너 민감 피부 케어 성분 가다 함유 되어다 로만 발라 피부 한번 써다 부드럽다 각질 감소 피부결 개선 분량 감소 성인 여성 대상 개인 성인 여성 피부 자극 지수 저자극 진정 토너 부자 극지 에이 토너 로사 용다 튀기다 카발 수트 수문 밉다 달다 의미 메이 토너 배촉촉 속보 증가 속보 증가 노란색 리트머스 가다 동일 컬러 지하 약산 이다 자사 내부 실험 결과 제품 이해 들다 돕기 자료 이다 에이 성분 다르다 효과 요소 고려 독자 원료 피부결 케어 성분 더하다 에스 라만 마진 솔루션 가다 에이 라인 공통 성분 피부결 케어 성분 에스 독자 개발 진정 성분 진정 진정 위해 필요 요소 결합 에스 라만 단독 원료 베타 글루칸 데카 사이드 수분 환경 조성 민감 부위 케어 피부 장벽 케어 치마 버섯 사체 추출 다딩체 촉촉 부드럽다 타입 토너 제형 바르다 순간 채우다 수분 가득 토너 에스 트라 기준 마스 탄생 에이 수분 진정 토너 피부 안전성 테스트 대학병원 피부 전문의 주관 성인 패치 테스트 자극 확인 성인 대상 동일 부위 누적 도포 알러지 유발 확인 마프 민감성 피부 자가 민감 패널 대상 주간 제품 사용 사용 적합 부적합 테스트 통과 이씨 코리아 드름성 주간 사용 모공 막다 피부 사용 적합 여드름 피부 적합 화장품 확인 테스트 이씨 코리아 일간 검증 명의 참여자 통해 탄생 안심 진정 수분 진정 토너 소프트 진정 패드 진정 마패 에이 수분 진정 토너 수분 진정 토너,1,1,1
96,134,[진정뿌토] 시카고 시카 엑스퍼트 미스트 토너 150ml,3,덥다 화장품 자연 유래 성분 만들다 시카고 탄생 시작 시카고 자연 유래 화장품 노하우 가지다 독일 바일 란트 연구소장 이소미 탄생 자연 유래 덥다 코스 브랜드 가다 만들다 천연 유래 덥다 코스 시카고 살짝 뿌리 지그시 흡수 카토 진정 뿌토 세안 직후 민감 완화 빠르다 진정 이필 수시 시카고 전제 독일 덥다 테스트 획득 화장품 바꾸다 두렵다 카피 부라 안심 사용 시카고 전제 품다 세계 알러지 학회 엄격 기준 적용 독일 덥다 테스트 엑설런트 받다 자극 자유 뿌리 카토 신정 뿌토 순하다 뻐른 피부 진정 손탤 필요 뿌리 카토 사상 세리 겨우살이 복합 민감 피부 카피 달다 토너 자극 극받 카피 부의 빠르다 진정 정돈 기다 피부 정돈 도와주다 피부 깊이 부드럽다 흡수 계시 진정 토너 이다 스킨 부럽다 촉촉햄 자연 유래 안심 카토 숙힌 자연 유래 성분 방부 원칙 독일 덥다 테스트 끄다 획득 민감 피부 카피 안심 이렇다 진정 뿌토 스킨 케어 단계 케어 원하다 민감 피부 화장솜 아내 자극 민감 피부 사상 성분 끝장 레시피 병풀 하나로 카피 부가 잡히다 병풀 은기 보다 시카고 상자 리신 겨우살이 추출 더하다 시카고 독자 자연 유래 레시피 만들다 자극 분사 피부 늘다 편안함 시카고 자연 유래 케어 성분 보습 보호 성분 저자극 빠르다 흡수 되어다 세안 후자 받다 은피 부의 빠르다 진정 정돈 도움 주다 촉촉 균형 잡히다 카피 바탕 케어 선사 투명 보습 가다 피부 에고 분사 산뜻하다 위터 제형 저자극 부드럽다 흡수 촉촉하다 마무 세안 얼굴 전체 사하 흡수 필요 따르다 감싸다 거나 두드 흡수 줄다 자연 유래 안심 포뮬라 자극 이나 건조 느껴지다 마다 수시 뿌리다 좋다 각질 정돈 필요 한경 화장솜 적다 부드럽다 아내 무방 밉다 카드 너펑 엑스 퍼트 미스트 토너 순면 화장솜 피부 예민 화장솜 엑스 퍼트 미스트 진정 이필 부위 민감 피부 진정 효과 이다 따다 제시카 피부 뿌토 뿌리 토너 가다 이다 성분 피부 에고 분사 케어 선사 자연 유래 케어 성분 보습 스며들다 빠르다 진정 전제 보기 진정 뿌토 뿌리 카토 패드 술톤 피부 즉각 진정,1,1,1
97,135,셀퓨전씨 트리악 pH 컨디션 토너 200ml,1,지성 트러블 케어 데일리 트러블 케어 모공 톡스 컨디션 클렌저 패드 토너 여드름 민감 수부지 지성 피부 미세먼지 올킬폼 데일리 산뜻 각질 토너 모공 축소 패드 파이널 레스큐 모이 스처 시럽 앰플 오인 트러블 진정 지성 피부 칼라 민앰플 송수 분젤,1,0,0
98,136,마녀공장 비피다 바이옴 앰플 토너 400ml,7,느낌 케어 제품 화해 베스트 위드 화해 상반기 베스트 신제품 어워드 스킨 토너 부문 어워드 상반기 그램 어워드 앰플 토너 부문 로우 어워드 수상 상반기 로우 어워드 워터 토너 부문 위너 단계 플로 시작 매일 근본 키우다 유산균 습관 공장 특별 배합 비피 바이옴 작다 자극 쉬다 예민 해지 피부 위해 준비 피부 기초 체력 강화 솔루션 피부 근본 세우다 피부 장벽 케어 균형 잡히다 건강 피부 경험 보다 앰플같 토너 트벼송 특별 피부 근본 케어 수분 장벽 강화 단계 앰플 케어 피부 근본 케어 수분 장벽 강화 솔루션 담기다 마녀 공장 근본 성분 비피 레시피 스킨 케어 내기 앰플 케어 효과 선사 줍다 비피 바이옴 앰플 토너 세안 스킨 케어 단계 플로 세안 피부 제일 먼저 주하 토너 미세 환경 변화 쉬다 반응 민감 건조 피부 라면 앰플 토너 사용 수입 매일 건강 바르다 건강 위해 유산균 매일 챙기다 바르다 프로바이오틱스 피부 근본 강하 외부 스트레스 튼튼하다 피부 위해 비피 바이옴 건강 유산균 케어 시작 생균 유산균 유래 복합 발효 성분 이다 건강 피부 만들다 마이크로 바이옴 마이크로 바이옴 외부 환경 피부 보호 피부 환경 강하 만들다 피부 필요 물질 건강 피부 관리 균형 잡히다 마이크로 바이옴 이다 상기 설명 원료 마이크로 바이옴 피부 존재 다양 미생물 생태계 사랑 받다 마녀 공장 근본 성분 개다 비피 건강 피부 장벽 위해 피다 프로바이오틱스 만나다 어요 효과 만들다 마이크로 바이옴 비피 바이옴 피부 본연 기르다 줍다 비피 바이옴 프로바이오틱스 콤플렉스 어우러지다 강력 피부 장벽 강화 효과 느끼다 보다 피부 보호 기초 잡다 건강 튼튼하다 피부 가꾸다 줍다 금방 증발 토너 스치다 분자 크기 수분 입자 건조 해지 쉽다 피부 사이사이 수분 흡수 피부 갈증 해결 수분 장벽 탄하 만들다 어요 아가 수분 보습 레이어 탄탄 족촉 감싸다 수분 막다 대다 몰다 보습 특허 성분 차원 피부 핵심 모공 케어 저자극 각질 케어 피부 쌓다 이기 쉽다 각질 노폐물 부드럽다 정리 주다 빠르다 진정 효과 탁월 모공 수렴 작용 피부 깨끗하다 관리 촉촉하다 마무리 피부 선사 걱정 피부 닮다 약산 토너 강하 관리 마무리 스킨 케어 시작 농축 앰플 토너 사용 끈적임 가볍다 마무리 남기다 촉촉하다 산뜻하다 피부 가꾸다 드립 어떻다 써다 좋다 다재 앰플 토너 금방 오다 어요 대다 여성 만족 토너 마음 들다 서다 계속 사용 싶다 제품 토너 이름 레이어 이이 흡토 흡수 굉장하다 빨르다 대여 흡토 사용 피부 토닥토닥 해주 흡수 굉장하다 라서 단계 스킨 케어 편하다 공식 몰다 리뷰 다방면 용해 유용 좋다 대여 저자극 어떠하다 땅김 부드럽다 자다 발리다 거나 꾸다 덕이 흐르다 촉촉하다 제형 바르다 부드럽다 자다 흡수 어요 피부 노폐 제거 피부결 정리 좋다 용량 대용량 시트 사서 진정 써다 다방면 유용 쓸다 좋다 공식 몰다 리뷰,1,1,1
99,138,크리니크 클래리파잉 로션 투와이스 어 데이 엑스폴리에이터 2 200ml,1,크다 리파 로션 트와이스 데이 익스 폴리 민감 건조 피부 관리 토너 크리 리프 레시 부드렵 상쾌 포뮬 건강 피부 위해 차별 도하 크리 크다 제품 이다 피부 묻다 오염 물질 각질 제거 부드럽다 매끄럽다 깨끗하다 도록 가꾸다 줍다 정화 피부 정화 기능 위치 성분 함유 뮬러 피부 산뜻 시원 깨끗하다 느낌 리프 레쉬 줍다 모이 스춰 라이 사용 피부 정돈 각질 제거 피부 모이 스춰 라이 자다 수하 도와주다 각질 관리 토너 제품 피부 본연 되찾다 아보 피부 거치다 피부 피지 피부 만들다 각질 매일 오염 물질 회장 인하다 피부 표면 각질 유발 세안 거치다 만들다 피지 화장솜 사용 보다 매일 아침 저녁 세안 크다 리피 로션 묻히다 각질 제거 피부 정돈 모이 스취 라이 저가 자다 흡수 도록 피부 산뜻 깨끗하다 유지시 줍다 바고 피부 타입 뮬러 제공 건성 피부 크다 리파 로션 트와이스 데이 엑스 폴리 복합성 피부 크다 리파 로션 트와이스 데이 엑스 폴리 지다 복합성 피부 크다 리파 로션 트와이스 데이 엑스 폴리 지성 피부 크다 리파 로션 트와이스 데이 엑스 폴리 건성 민감성 피부 크다 리파 로션 트와이스 데이 엑스 폴리 지성 피부 피지 제거 모공 깨끗하다 유지시 줍다 건성 피부 각질 제거 피부 표면 흡수 촉진 시킴 크다 파잉 로션 트와이스 데이 엑스 폴리 민감 피부 부드럽다 각질 제거 알코올 프리 포뮬라 각질 부드럽다 제거 크리 크다 각질 토너 사용 후기 세안 클렌징 어도 각질 제거 화이트헤드 도움 이중 클렌징 효과 부드럽다 밝다 피부 가꾸다 줍다 용한 지성 피부 민하 되어다 이제 얼콜 부드럽다 매끄럽다 밝아지다 아침 저녁 세안 화장솜 이중 클렌징 되어다 피부 정돈 모이 스춰 라이 저가 자다 흡수 되어다 게속 사용 이다 세안 각질 가장 깨끗 건강 피부 가꾸다 주다 스킨 케어 깨끗 매끄럽다 빛나다 피부 피부 타입 맞춤 루틴 가꾸다 보다 세안 각질 관리 건조 뮬러 피부 묻다 오염 물질 타입 맞다 각질 제거 가끗하 깨끗하다 피부 줍다 줍다 사용 방법 하루 아침 사용 사용 얼굴 크리 크다 스킨 케어 단계 세안 보습 이드 레이 케어 탄생 크리 크다 스킨 케어 시스템 도입 선구자 이다 크리 크다 저자극 성분 들다 사용 려고 노력 피부 필요 효과 들다 빠뜨 리지 려고 노력 크리 크다 엄격 통해 얻다 지식 활용 피부 건강 안전 성분 들다 개발 되어다 크리 크다 깨끗하다 철학 지키다 나가다 약속 끊다 테스트 크리 크다 제품 높다 안정 성과 효율 성의 기준 적합 위해 개발 단계 별로 저하 평가 연구 제작 크리 크다 포뮬라 성분 성분 혼합 모든 단계 별로 끊다 테스트 지속 구합 크리 크다 깨끗하다 철학 크리 크다 스킨 탁월 주다 묘뮬라 약속 파라 베다 인공 향료 건강 행복 피부 코롱 제품 제외,1,1,1
100,140,브이앤에이뷰티 안티옥시던트 에센스 토너 120ml,1,모공 케어 더하다 해진 투명 피부 투명 항산화 피부결 차오 보습 한층 맑다 고환 빈틈 이조 여주 에센스 바르다 투명 바탕 케어 모공 케어 밀도 보습 케어 밉다 서브 인체 피부 효능 유해 의심 일차 자극 시험 완료 성분 바제 친환경 패키지 달라 고분자 네트워크 기술 사하 풍부 보습 즉각 보습 개선 효과 사용 직후 효능 차이 만들다 진화 원료 기술 허다 성분 폴리 테놀 티보 데베논 높다 성산 소거 강력 항산화 효과 데베논 블랙 추출 항산화 효과 허브 레머 디스 찾다 항산화 시크릿 폴리 테놀 신화 우수 약용 허브 전통 방식 발효 로지 교하 융합 주출 특허 번호 치유 불리 나니 워터 반물 작다 입자 피부 치유 불리 영국 빅토 여왕 사랑 프리미엄 워터 피부 수분 유지 줍다 제수 대신 게이트 블랙 고품 게이트 블랙 담다 차원 모공 수련 항산화 더블 이펙트 선사 원료 특성 항산화 토너 적용 작품 윌리엄 모리스 가다 제작 페이퍼 패턴 해석 디자인 이다 보다 작품 버드나무 덩굴 복잡하다 큼지막하다 양귀비 사이사이 잔잔 뿌리다 청아 봄맞이 특징 이다 자연 형상 반복 패턴 아내 모리스 작가 독창 기법 대다 표적 아트워크 안티옥 시던트 라인 허브 레머 디스 감각 컬러 표현 내다 보다 작품 소유권 영국 브이 에이 지엄,1,1,1
101,143,[이진욱PICK]오딧세이 챕터파이브 안티옥시던트 생츄어리 2종 택1 (토너/모이스처라이저),1,년월 출시 감각 슬로우 에이 스킨 케어 항산화 성분 피부 진정 각질 케어 성분 통해 피부결 정돈 수분 공급 안티옥 시던트 토너 항산화 성분 피부 장벽 강화 진정 성분 통해 산뜻하다 고촉 한보 습감 사하 안티옥 시던트 모이 스처 라이 하루 시작 하루 완성 의미 일상 시작 주하 섬세 주얼 스킨 케어 경험 보다 방해 받다 온전 나르다 한시 간과 내면 목소리 보다 질적 대한 탐구 영감 흙내 수항 대프 수향 에이 티브 디렉터 라이트 하우스 생기 트러스 네롤 리향 자다 물리 생츄 어리다 싱그럽다 무화과 맑은 편백나무 이끼 고요한 저녁 립니 매력 다양 마다 적절 고르다 써다 보시 추천 드리다 맨즈 라이프스타일 크리에이터 크다 민감 피부 걱정 피부 안전성 테스트 완료 아모레퍼시픽 깔다 깔다 부과 테스트 통과 항산화 슬로우 이징 스킨 케어 피부 노화 케어 해주 항산화 효과 고성 청장 해양심층수 레티놀 유사 효능 성분 바쿠 오다 항산화 안티 이징 효과 사하 피부 노화 예방 더욱 부로 완성 모의 라이 한정 식물 추출 피부 보습 진정 효과 깨끗하다 증류수 섬세 정제 편백 탁무잎추술불 이함 되어다 외부 자극 민감 피부 삐르 진정 줍다 주름 개션 미백 고기 능성 뮬러 남성 피부 효과 카페인 성분 피부 장벽 강화 해주 아데노신 나이아신 아마이드 성분 주름 개선 미백 줍다 모이 스처 라이 한정 안티옥 시던트 안티옥 시던트 토너 모이 스처 라이 새다,1,1,1
102,144,[NEW] 라운드랩 소나무 진정 시카 토너 250ml,3,집중 진정 진정 소나무 진정 로너 무진 정시 카토 진정 토너 라문드랩 직원 들이다 소나무 진정 로너 천하 이유 토로 흡토 사용 좋다 마무리 면서 수분 가득 채우다 사용감 데일리 피부 계절 추천 지성 대다 상품 기획 진정 효과 부스 최고 조합 결정 한번 두드 주다 촉촉 부드럽다 피부 완성 자극 이나 끈적임 순하다 스킨 케어 단계 시작 리미 약하다 물리 스크럽 거치다 고민 었는데 소나무 진정 토너 만나다 런하 경어 채우다 각질 지성 대다 잠재 남다 방울 소중하다 토너 이다 마케팅 바쁘다 일상 사극 지치다 피부 몬전 따다 가운 자외선 건조 바람 급격 온도 미세먼지 일상 지치다 다양 환경 피부 지키다 위해 라운드 양양 소나무 찾다 연구 어요 카토 오름 고장 강원도 양양 자라다 사시 사철 푸르른 생명력 담다 어요 소나무 지속가능성 찾다 어요 나무 훼손 떨다 소나무 라문드랩 독자 진정 성분 만들다 어요 으르 전하 담다 모이 션부 소나무 진정 효능 전하 전달 도록 저온 초음파 추출 전하 담다 어요 소나무 액티버 함유 라문드랩 독자 성분 소나무 액티버 소나무 기문 느끼다 보다 소나무 추출 아시아 틱애 씨드 라이코 프로 데카 식애 씨드 벼프츠츠무 데카 사이드 아시아 티코 사이드 소나무 액티버 소나무 추출 식물성 단백질 라이코 프로 성분 라운드 노하우 담다 배합 독자 성분 외부 민감 피부 고민 다각도 빠르다 케어 해주 건강 피부 가꾸다 드릴 거치다 머진 피부결 진정 민감 피부 순하다 성분 모공 막다 필요 각질 노폐물 마일 드하 케어 피부 정돈 드리다 저분자 분자 고분자 다양 사이스 히알루론산 담다 수분 차곡 차곡 채우다 촉촉 피부 케어 주다 피부 부드럽다 스내들어 채우다 산뜻하다 마무리 소나무 진정 카토 소나무 진정 써다 진정 토너 진정 로션 수분 장벽 크림 소나무 진정 카토 소나무 진정 크림 진정 마스크 멀티 진정 앰플 진정 패드 긴급 한장 마스크 소나무 진정 앰플 소나무 진정 패드 소나무 진정 마스크 평균 피부 반응 늘다 판정 기준 따르다 자극 판정 한국 피부 과학 연구원 소나무 진정 로너 전성 진정 케어 보습 케어 각질 케어 정제 소나무 추출 프로판 다이올 글리세린 핵산 다이올 부틸렌 글라이콜 알루 닉애 씨드 하이 드롤 라이즈 드하 알루로닉애 씨드 이알루로네이트 라이코 프로 세린 인도 멀구슬나무 추출 인도 멀구슬나무 추출 아시아 티코 사이드 마데 크다 사이드 데카 식애 씨드 글루 코노 락톤 프릴 살리다 릭애 씨드 소늄 시트 레이 하이 드록 시아 세토 페논 다이소 이디티에이 시트 릭애 씨드 건강 지구 지키다 위해 콘텐츠 제작 연월일 콘텐츠 제작자 서린 컴퍼니 서린 컴퍼니 판매 모든 상품 대한 저작물 콘텐츠 산업 근거 보호 받다 모든 법적 관리 가지다 서린 컴퍼니 무단 복제 수정 관련 의거 형사 상의 받다,1,1,1
103,147,유리아쥬 제모스 토너 250ml,4,패키지 리뉴얼 안내 유리아 토너 가다 투명 용기 변경 되어다 성분 변경 단순 패키지 변경 되어다 안심 사용 재고 상황 따르다 변경 제품 발송 강하다 토너 제모 토너 도시 보호 받다 보습 피부 가다 까운 유리아 온천 유리아 온천 함유 피부 진정 수분 공급 도시 보호 받다 수분 보호 형성 강하다 제모 토너 사용 효과 보습 수분 보호 도시 보호 받다 매끄럽다 촉촉하다 피부 케어 주시 용후 유리아 제모 스토 이렇다 추천 메이크업 밀리 곽찬 뽀대 비다 수분감 원하다 메이크업 저녁 스킨 케어 루틴 스킨팩 사용 데일리 보습 케어 토너 필요 토너 활용 단계 토너 사용 부드럽다 정돈 지다 노폐물 제거 피부 당기다 거나 건조 부위 각질 일어 늘다 부위 모스 토너 회장 토너 패드 적다 활용 세안 양치질 머리 말리 잠들다 세안 토너 뜨겁다 바람 토너 진정 수분 피부 수분 채우다 보다 피부 수분 그대로 피부관리 건조 당기다 가다 피부 보습 완성 유리아 제모 라인 제모 스신데뜨 제모 스토 제모 제모 스페이스 제모 스끄렘 모스 세라 뜨다 보습 보습 건성 각질 피부 빠르다 흡수 바디 보습 고영 밀크 클렌저 온천 토너 진정 크림 강하다 보습 크림 보습 로션 이다 시브 크림 건조 인하다 가려움 피부 가다 까운 유리아 온천 수의 역사 유리아 온천 수가 태어나다 프랑스 남부 알프스 산맥 위치 아름 다운 도시 유리아 온천 온천 센터 스킨 케어 알프스 천수 설립 유리아 쥬몬 천수 그대로 뛰어나다 수분 진정 효능 효과 공식 인증 완료 더모 코스 유리아 한국 소비자 포럼 브랜드 고객 충성 대상 더모 코스 부문 피부 등장 성의 유리아 온천 저장 일반 온천 고장 액바닷 크기 크기 변화 크기 팽창 크기 수축 삼투압 농도 비교 유리아 온천 등장 흐르다 체액 눈물 삼투압 농도 사하 피부 컨디션 변화 피부 편안 작용 수분 달력 뛰어나다 공식 수입 판매원 로고 확인 보다 제품 프랑스 국내 공식 수입 판매원 케이 공급 정품임 인증 케이 공급 공식 수입품 제품 구매 상적 유통 경로 공급 제품 제품 이나 피부 생기 보상 받다 모든 제품 이미지 상세 이지 지다 케이 무단 도용 법적 조치 강력 대응 알다 드립,1,1,1
