Unnamed: 0.1,Unnamed: 0,name,len_img,ad,soothing,moisturizing,skin
0,0,[2023어워즈/3년연속] 아누아 어성초 77 수딩 토너 350ml 어워즈 한정 기획 (본품+리필팩+진정마스크1매),9,단독 어워즈 한정 기획 버워스 토너 부문 단독 어워즈 한정 기획 아누 어성초 수딩 토너 구성 아누 어성초 수딩 토너 리필팩 진정 마스크 네이버 쇼핑 스킨 토너 부문 기준 뷰티 어워즈 관왕 빚나 어성초 토너 만족 구매 자가 간증 이유 어요 아누 토너 구매 한지 많다 도움 받다 어요 먹다 어유 통째 사서 쓰다 어요 사용자 모으다 써다 보다 바꾸다 정말 피부 케어 테스트 증명 제품 속도 피지 분비 줄어들다 사용감 체적 만족 스럽다 여드름 피부 사용 적합 대한 인제 적용 시험 허다 사용 주관 설문 조사 결과 응답 개인 한국 피부 과학 연구원 남녀 수딩 토너 다르다 느낌 실제 인체 적용 시험 피지 확인 어요 인체 적용 시험 사용 변화 여드름 피부 사용 모공 막다 사용 인체 적용 시험 테스트 어성초 추출 아스 수분 가득 피부 편안 피부 진정 효과 성분 어성초 추출 담다 예민 민감 피부 진정 도움 줍다 사용 직후 한국 피부 과학 연구원 자극 지수 예민 걱정 어요 부임 상연 세다 시험 기간 성조 수딩 토너 사용 일시 분량 증가 효과 사용 직후 이스트 트리 추출 우엉 뿌리 추출 베타 쇠비름 추출 소듬 하이 알루로네이트 부틸렌 글라이콜 하이 드록시 프로필 라이 모늄 하이 알루로네이트 하이 드롤 라이즈 드하 알루로닉데 씨드 글리세린 트리 카리아 주출 소듬아세틸 레이 하이 알루로네이트 하이 알루로닉애 씨드 진흙 버섯 주출 소듬 하이 알루로네이트 크로스 폴리머 포타슴 하이 알루로네이트 쓰다 좋다 예민 부추 피지 피부 추천 흡토 데일리 수분 중전 각질 케어 환경 각하 아누 지속 가능 방식 보호 산림 인증 받다 파키 오다 식물성 잉크 콩기름 인쇄 분해 재활용 이합 제품 인쇄 제작 피부 편안 나르다 채우다 아누,1,0,0
1,1,[12/4 하루특가][2023어워즈] 아비브 어성초 카밍 토너 스킨부스터 더블 기획 (200ml+200ml),4,올리브영 어워즈 진정 케어 기준 아비 어성초 토너 스킨 토너 어성초 토너 더블 어워즈 기획 정기 저자극 진정 구성 어성초 토너 진정 저자극 피부결 케어 보습 케어 정돈 스킨 토너 이다 내기 화해 설문 검증 아비 어성초 토너 피부 진정 민감 계절 상관 사용 좋다 피부 진정 좋다 어성초 재구매 궁금 제일 유명 제품 사용감 좋다 건성 홍조 피부 진정 좋다 스킨팩 처럼 쓰다 진정 쿨링감 넘치다 좋다 계속 쓰다 싶다 어요 아비 어성초 청정 지역 지리산 시작 어성초 추출 피부 진정 도움 주다 깨끗 건강 피부 가꾸다 줍다 개선 물리 자극 황금 추출 금은화 추출 피부 온도 낮추다 주어 민감 피부 편안 진정 줍다 원료 특성 개선 인체 피부 일차 자극 테스트 치앤 바이오 부임 상연 센터 매일 달라 피부 컨디션 맞추다 양하 사용 보다 수분 진정 세안 적당 토너 피부 두드 흡수 면서 수분 공급 해주 피부결 정돈 아침 저녁 세안 화장솜 토너 적당 적다 피부결 따르다 정돈 해주 아비 어성초 토너 해보다 거치다 어진 피부결 개선 싶다 자극 순하다 토너 찾다 어성초 어성초 오일 워시 어성초 바디 워시 약산 클렌저 진정 바디 케어,1,1,1
2,2,[한정기획] 라네즈 크림스킨 170ml 리필 기획 (+170ml 리필),10,크림 스킨 리필팩 기획 세트 기획 세트 기획 세트 구성 크림 스킨 리필팩 오특 비아 최초 라네즈 크림 스킨 리필 오늘 드림 증정 올리브영 전체 판매 랭킹 기준 세대 세대 라네즈 재구매 누적 판매 돌파 글로무픽설 무단 소라 보습 뷰티 포인트 적립 자사 판매 경로 라네즈 스킨 케어 재구매 율기 촉촉 탄탄 틀다 틀다 저자극 보습 탄력 장벽 진정 흡수 피부 촉촉하다 부속 기지 피부 진정 되어다 시험 기관 리드 시험 대상 대다 여성 건성 피부 시험 기간 사용 직후 사용 더하다 탄력 장벽 케어 동시 크기 녹이다 단계 깊다 라네즈 기존 크림 임자 크기 비교 뮬러 순하다 피부 테스 완료 미스트 펌프 별도 판매 상품 이다 성분 보습 강력 이제 탄력 장벽 가다 사막 떨다 탄력 쉬다 무너 피부 장벽 아직 수분 채우다 세대 크림 스킨 더하다 성분 피토 아세틸 스킨 제형 최적화 이드 세라 마이 탄력 감소 방어 탄력 증진 마르지 보습 바르다 기전 바르다 직후 크림 스킨 바르다 직후 시험 대상 대다 여성 건성 피부 시험 기간 바르다 직후 이미지 이미지 보습 지속 어요 유지 해주 탄력 장벽 탄력 개선 장벽 강화 바르다 기전 바르다 기전 크림 스킨 사용 탄력 개선 장벽 강화 되어다 피부 강하 강력 보습 오래 갈다 어요 사용 기준 시험 기관 시험 대상 대다 여성 건성 피부 시험 기간 기술 단계 깊다 크림 스킨 녹이다 기술 이인 가다 크림 입자 스콘 고압 블랜딩 공정 크림 단위 쪼개다 스킨 안정화 어요 라네즈 기존 크림 입자 크기 비교 크림 제형 기술 도적 보습 가능 지다 어요 크림 스킨 내다 차이 일반 스킨 크림 스킨 스킨 스킨 크림 사용 사용 라네즈 구형 스킨 크림 일반 크림 스킨 차이 날다 크림 단계 별로 바르다 크림 스킨 크림 바르다 보습 시너지 시험 기관 부임 상연 세다 허다 대상 대다 여성 건성 피부 시험 기간 사용감 한번 찾다 수회 아모 퍼시픽 특화 재배 광합성 조절 하얗다 대비 일반 녹차 대비 아미노산 풍부 진정 성분 화이트 리프 발라 순하다 외부 자극 한일 시적 붉다 은기 회복 회복 적외선 노출 크림 스킨 적용 진정 효과 화이트 리프 증량해 외부 자극 의하다 일시 붉다 은기 회복 시험 기관 부임 상연 세다 시험 대상 대다 여성 건성 피부 시험 기간 저자극 뮬러 이포 알러지 스트 완료 모비 민감성 피부 테스트 완료 크림 스킨 사용 서도 사무실 프랑스 수입 펌프 곱다 안개 분사 이제 크림 스킨 보습 서나 느끼다 보다 미스트 펌프 별도 판매 상품 이다 플라스틱 절감 가격 착하다 리필 환경 비용 아끼다 리필 별도 판매 상품 이다 지속 가능 사다 실현 위해 손쉽다 분리 배출 인증 획득 우수 재활용 위해 단상 지류 사용 어요 리무버 라벨 사용 어요 리필 재활용 라네즈 최초 스킨 케어 리필 물발자국 측정 완료 입하 대비 용량 효율 플라스틱 절감 어요 수자원 활용 위해 노력 어요 안심 사용 크림 스킨 본토 내용물 전하 아주 구조 설계 되어다 아모레퍼시픽 봉하 제품 보내다 드리다 약속 리오니 안심 사용 주의 사항 식물 유래 오일 함유 뮬러 특성 흰색 형태 오일 생기다 제품 용기 희다 흔들다 사용 줄다 저온 장기간 보관 크림 그대로 녹이다 내다 제형 특성 크림 성분 보이다 제품 체온 녹이다 사용,1,1,1
3,3,[2023어워즈] 라운드랩 1025 독도 토너 500ml 어워즈 한정기획(+크림50ml+패드10매),17,단독 구성 자작나무 수분 크림 수분 진정 비타 일루 동시 차오 수분 필요 지치다 피부 전하 수분 라인 라운드 독도 도너 자작나무 수분 크림 라운드 자작나무 수분 배드 빌다 국민 로너 뷰티 유서 뜻오 주목 받다 국민 토너 선택 관왕 크다 라운드 프로젝트 독도 로너 얼루어 품평 바버으 결과 대다 간단 셜하 저자극 각질 케어 성분 부드럽다 피부 케어 으르 울릉도 해양심층수 촉촉하다 수분 밸런스 유지 진정 보습 외부 환경 자극 받다 피부 편안 보호 라운드 피부 자극 적다 성분 피부 표면 쌓이다 피지 묵다 각질 부드럽다 케어 주다 칠기 파라미터 사용 이노 피부 과학 연구소 여성 사용 직후 이노 피부 과학 연구소 여성 피지 케어 이노 피부 과학 연구소 여성 이노 피부 과학 연구 여성 햇빛 바다 깊다 끌다 올리다 깨끗 청정 인체 유사 미네랄 밸런스 민감 피부 안심 사용 어요 아연 피부 유익 영양 미네랄 부하 함유 되어다 피부 촉촉하다 수분 채우다 피부 진정 효과 파다 알란 토인 베타 성분 외부 환경 자극 받다 피부 편안 보호 도움 주다 바르다 뜨다 분만 구성 워터 타입 텍스처 순간 피부 감싸다 끈적임 마무리 수어 세안 적당 덜다 분하다 적다 줍다 부드럽다 정돈 줍다 라문드랩 독도 로너 더하다 활용 피부 진정 효과 보습 효과 워터 부분 진정 여러 치다 발라 빠르다 진정 효과 피부 수분 충전 피부 저자극 스르 완료 자극 순하다 인체 적용 시험 결과 요약 서원 원퍼 독도 토너 피부 철포 안전성 처치 망명 선호 위자 철포 무어 세부 원자 철모 철포 제거 시긴 새시 기다 국제 첩쑥피 부연 학회 밉다 국화장 용업회 평균 피부 반응 늘다 판정 기준 따르다 자극 판정 시험 결과 시선 지르다 보다 보고서 저작권법 영업비밀 법률 의거 허가 목적 용도 이용 보다 연구소 서면 동의 부분 전체 양도 열람 인용 복제 전송 공개 정제 부틸렌 글라이콜 글리세린 펜틸렌 글라이콜 프로판 다이올 아이리쉬 모스 추출 사탕수수 추출 해수 프로 베타 파다 에틸렉실 글리세린 이디티에이 콘텐츠 제작 연월일 콘텐츠 제작자 서린 컴퍼니 서린 컴퍼니 판매 모든 상품 대한 저작물 콘텐츠 산업 근거 보호 받다 모든 법적 관리 가지다 서린 컴퍼니 동의 무단 복제 수정 관련 의거 형사 상의 처벌 받다 자작나무 수분크림 분진 비타 히알루론산 글리 클린 뷰티 평가 설문 결과 설문 느끼다 지지 제공 받다 제공 받다 주간 사용 기간 설문 기간 수력 만족도 순하다 제품 만족도 메이크업 들뜨다 화해 설문 명의 응답 결과 수분 밉다 족하 늘어나다 피부 고민 수분 자작 크림 필요 자작나무 수액 비타 히알루론산 글리 세릴글루코 사이드 성분 오랫동안 마르지 깊다 보습 유지 주다 직후 인체 피부 보습 지속 효과 평가 시험 이노 피부 과학 연구소 기간 인원 인제 자작나무 정량 수분 담다 선선 바람 청량하다 기운 대금 자라 인제 자작나무 수액 아미노산 미네랄 부하 건소 피부 수분 공급 촉촉하다 피부 유지 주다 자작나무 수분크림 수분 진정 비타 히알루론산 외부 환경 사극 받다 마르다 피부 생기 피부 만들다 피부 완화 도움 되어다 피부 들다 완화 이노 피부 과학 연구소 안면 피지 감소 효고 주사 용후 제품 전과 비교 시점 안면 부위 피지 유의 감소 피부 분량 감소 사용 제품 사용 전과 비교 사용 시점 부위 피부 분량 유의 감소 제품 사용 전과 비교 사용 시점 안면 부위 개방 면포 블랙헤드 유의 감소 며드름섬 피부 완료 여드름 피부 사용 적합 인체 적용 시험 민감 피부 자극 순하다 사용 어요 보고서 요약 라운드 자작나무 수분크림 대한 인체 어드름성 피부 사용 적합 평가 시험 자작나무 수분 크림 보다 시험 제품 인체 여드름 이노 피부 과학 연구소 수분 수분 캡술 뮬러 크림 응축 아들 수분 피부 부드럽다 강력 수분 채우다 주어 사용 깨다 세티 지다 스킨 케어 마무리 단계 내용물 적당 덜다 줍다 피부 수분 입히다 부드럽다 흡수 줍다 캡슬 보습 성분 피부 흡수 도록 톡톡 두드 줄다 피부 일차 자극 측면 무자 극성 제품 판정 비개 가다 이이 시세 이태 정제 글리세린 소노닐 나노 에이트 소도 데케 펜텔 글라이콜 폴리 세다 자작나무 수액 호호 에스터 글리 세릴글루코 사이드 라비 고무나무 이드 롤라이 스드 오크라 추출 소득 하이 알루로 이트 하이 알루로닉애 씨드 화이트 루핀씨 추출 드럼 스틱 추출 인도 멀구슬나무 추출 몰다 인도 멀구슬나무 추출 무꽃 추출 아이비 열매 추출 몰다 로어 추출 열매 추출 홀리 바질 추출 차다 산호 추출 울금 뿌리 추출 아스코 빅애 씨드 펜타 리스 리틸 테트라 틸렉사노 에이트 암모늄 아크릴 일다 메틸타 우레이 브이 피코 폴리머 폴리 글리 세릴 글루코오스 다이스 레이 아크 릴레이 알킬 릴레이 크로스 폴리 로메 글리 세릴 아크 릴레이 아크릴 릭애 씨드 폴리머 에틸렉실 글리세린 아가 이포 타슴 글리 리제 글리 세릴카 릴레이 부틸렌 크다 라이 다이소 이디티에이 건강 한지 인증 지키다 위해 친환경 종이 밉다 크다 사용 용량 중량 제품 주요 사양 모든 피부 사용 기한 개봉 사용 기간 제조 년월 개봉 개월 개봉 개월 제조 분부 순차 출고 화장품 제조업 코스 맥스 화장품 책임 판매업 서린 컴퍼니 제조 대한민국 사용 주의 사항 상세 페이지 표시 가다 화장품 사용 사용 직시 광선 사용 부위 붉다 반점 부어 오름 가려움증 증상 부직 용이 전문의 상담 상처 부위 사용 자제 보관 취급 시주 머린 이의 당지 관할 직사 광선 피해 보관 콘텐초 제작 연월일 콘텐츠 제작자 서린 컴퍼니 서린 컴퍼니 판매 상품 대한 콘텐츠 산업 진흥 조제 근거 보호 받다 법적 관리 가지다 서린 컴퍼니 동의 무단 복제 수정 관련 의거 형사 상의 받다 빌다 국민 로너 뷰티 유서 뜻오 주목 받다 국민 토너 선택 관왕 크다 라운드 프로젝트 독도 로너 얼루어 품평 바버으 결과 대다 간단 셜하 저자극 각질 케어 성분 부드럽다 피부 케어 으르 울릉도 해양심층수 촉촉하다 수분 밸런스 유지 진정 보습 외부 환경 자극 받다 피부 편안 보호 라운드 피부 자극 적다 성분 피부 표면 쌓이다 피지 묵다 각질 부드럽다 케어 주다 칠기 파라미터 사용 이노 피부 과학 연구소 여성 사용 직후 이노 피부 과학 연구소 여성 피지 케어 이노 피부 과학 연구소 여성 이노 피부 과학 연구 여성 햇빛 바다 깊다 끌다 올리다 깨끗 청정 인체 유사 미네랄 밸런스 민감 피부 안심 사용 어요 아연 피부 유익 영양 미네랄 부하 함유 되어다 피부 촉촉하다 수분 채우다 피부 진정 효과 파다 알란 토인 베타 성분 외부 환경 자극 받다 피부 편안 보호 도움 주다 바르다 뜨다 분만 구성 워터 타입 텍스처 순간 피부 감싸다 끈적임 마무리 수어 세안 적당 덜다 분하다 적다 줍다 부드럽다 정돈 줍다 라문드랩 독도 로너 더하다 활용 피부 진정 효과 보습 효과 워터 부분 진정 여러 치다 발라 빠르다 진정 효과 피부 수분 충전 피부 저자극 스르 완료 자극 순하다 인체 적용 시험 결과 요약 서원 원퍼 독도 토너 피부 철포 안전성 처치 망명 선호 위자 철포 무어 세부 원자 철모 철포 제거 시긴 새시 기다 국제 첩쑥피 부연 학회 밉다 국화장 용업회 평균 피부 반응 늘다 판정 기준 따르다 자극 판정 시험 결과 시선 지르다 보다 보고서 저작권법 영업비밀 법률 의거 허가 목적 용도 이용 보다 연구소 서면 동의 부분 전체 양도 열람 인용 복제 전송 공개 정제 부틸렌 글라이콜 글리세린 펜틸렌 글라이콜 프로판 다이올 아이리쉬 모스 추출 사탕수수 추출 해수 프로 베타 파다 에틸렉실 글리세린 이디티에이 콘텐츠 제작 연월일 콘텐츠 제작자 서린 컴퍼니 서린 컴퍼니 판매 모든 상품 대한 저작물 콘텐츠 산업 근거 보호 받다 모든 법적 관리 가지다 서린 컴퍼니 동의 무단 복제 수정 관련 의거 형사 상의 처벌 받다 자작나무 수분크림 분진 비타 히알루론산 글리 클린 뷰티 평가 설문 결과 설문 느끼다 지지 제공 받다 제공 받다 주간 사용 기간 설문 기간 수력 만족도 순하다 제품 만족도 메이크업 들뜨다 화해 설문 명의 응답 결과 수분 밉다 족하 늘어나다 피부 고민 수분 자작 크림 필요 자작나무 수액 비타 히알루론산 글리 세릴글루코 사이드 성분 오랫동안 마르지 깊다 보습 유지 주다 직후 인체 피부 보습 지속 효과 평가 시험 이노 피부 과학 연구소 기간 인원 인제 자작나무 정량 수분 담다 선선 바람 청량하다 기운 대금 자라 인제 자작나무 수액 아미노산 미네랄 부하 건소 피부 수분 공급 촉촉하다 피부 유지 주다 자작나무 수분크림 수분 진정 비타 히알루론산 외부 환경 사극 받다 마르다 피부 생기 피부 만들다 피부 완화 도움 되어다 피부 들다 완화 이노 피부 과학 연구소 안면 피지 감소 효고 주사 용후 제품 전과 비교 시점 안면 부위 피지 유의 감소 피부 분량 감소 사용 제품 사용 전과 비교 사용 시점 부위 피부 분량 유의 감소 제품 사용 전과 비교 사용 시점 안면 부위 개방 면포 블랙헤드 유의 감소 며드름섬 피부 완료 여드름 피부 사용 적합 인체 적용 시험 민감 피부 자극 순하다 사용 어요 보고서 요약 라운드 자작나무 수분크림 대한 인체 어드름성 피부 사용 적합 평가 시험 자작나무 수분 크림 보다 시험 제품 인체 여드름 이노 피부 과학 연구소 수분 수분 캡술 뮬러 크림 응축 아들 어더 수분 캡슬 피부 부드럽다 강력 수분 채우다 주어 사용 스킨 케어 마무리 단계 내용물 적당 덜다 줍다 캡슬 보습 성분 피부 흡수 도록 톡톡 두드 줄다 라문드랩 민감 피부 안심 사용 화장품 만듭니 세기 나기 가다 이의 피부 일차 자극 측면 무자 극성 제품 케메 가다 이태 정제 글리세린 소노닐 나노 에이트 소도 데케 펜틸렌 글라이콜 폴리 세다 자작나무 수액 호호 에스터 파다 글리 세릴글루코 사이드 라비 고무나무 이드 롤라이 스드 오크라 추출 몰다 소듬 하이 알루로 이트 하이 알루로닉애 씨드 화이트 루핀씨 추출 드럼 스틱 추출 인도 멀구슬나무 추출 아이비 열매 추출 로에베 추출 열매 추출 홀리 바질 추출 산호 주출 울금 뿌리 추출 아스코 빅애 씨드 펜타 리스 리틸 테트라 틸렉사노 에이트 암모늄 아크릴 일다 메틸타 우레이 브이 피코 폴리머 폴리 글리 세릴 메틸 글루코오스 다이스 레이 아크 릴레이 알킬 릴레이 크로스 폴리 로메 글리 세릴 아크 릴레이 아크릴 릭애 씨드 폴리머 에틸렉실 글리세린 아가 글리 세릴카 릴레이 부틸렌 글라이콜 다이소 이디티에이 제작 되어다 콘텐츠 제작 연월일 콘텐츠 제작자 서린 컴퍼니 서린 컴퍼니 판매 모든 상품 대한 콘텐츠 산업 근거 보호 받다 모든 법적 관리 가지다 서린 컴퍼니 동의 무단 복제 수정 관련 의거 형사 상의 처벌 받다,1,1,1
4,4,[백현팬싸응모]브링그린 티트리시카 수딩 토너 500ml 어워즈 한정기획(+크림20ml+징크테카세럼 7ml),11,강력 트리 싸르 케어 올리브영 대표 트러블 토너 수상 올리브영 어워즈 스킨 토너 부문 수상 올리브영 단독 어워즈 한정 기획 토너 세다 크림 트리 수딩 토너 어워즈 한정 기획 트리 수딩 토너 트리 수딩 크림 크다 출시 품절 대란 평소 브링 그린 사용 쓰다 후기 새롭다 리뉴얼 되어다 예쁘다 변하다 트리 라인 겉모습 변하다 제품 리뉴 얼다 제품 사용 재구매 부가 예민 자극 토너 찾다 제스 제품 이자 극도 고순 좋다 올리브영 브링 그린 트리 수딩 토너 온라인 몰리 브링 그린 트리 수딩 토너 새롭다 트리 수딩 토너 카토 진정 오른 피부 더욱 탄탄 시원 트리 콤플렉스 쿨링 이펙트 강하다 브링 그린 트리 성분 브링 그린 독자 기술 블렌딩 기존 수분 진정 효능 우수 트리 콤플렉스 오다 성분 담다 중티 트리 콤플렉스 병풀 추출 트리 콤플렉스 트리 트리 트리 줄기 트리 오일 트리 잎수 특성 자사 사용 트리 주출 병풀 추출 대비 트리 콤플렉스 병풀 액티브 수분 효능 평가 시험 결과 오른 피부 수분 가득 텍스쳐 온도 수분 피부 온도 감소 테스트 뚜더 마코 스메틱 피부 과학 연구소 헤드 화이트 피부 피지 개선 블랙헤드 개방 면포 화이트헤드 글로벌 의학 연구 센터 예민 피부 고민 남녀 민감성 피부 여드름 피부 사용 자극 테스트 완료 적합 테스트 완료 처쥐 글로벌 의학 연구 센터 청량하다 워터 타입 텍스처 피지 케어 유화 트리 추출 정제 프로필렌 글라이콜 트리 추출 비스릭선 타이 분림민 클리 트리 줄기 추출 베타 파다 옥틸 도데 세스 소늄 시트 레이 시트 릭애 씨드 트리 오일 베타 살리다 레이 추출 공법 남다르다 만들다 트리 공법 제주 자원 식물 연구소 브링 그린 전용 필지 전용 싱그럽다 운수 분가 가을 트리 채취 방식 재배 영양분 에너지 가득 지니다 이하 병풀 사용 따뜻하다 우려 트리 공중 띄우다 증기 유효 성분 추출 쓰다 진정 시너지 러블 토너 트러블 트러블 크림,1,0,0
5,6,[7일특가]바이오더마 하이드라비오 토너 500ml,4,바이오 덥다 온라인 구매 정품 인증 마크 확인 나오다 스코리아 가다 공식 수입 바이오 덥다 판매 페이지 정품 인증 마크 인증 표시 되어다 마크 판매 페이지 구매 상품 품질 보증 어리다 본사 제공 고객 받다 상세 페이지 무단 도용 적조 강력 대다 제품 로고 디자인 리뉴얼 되어다 안내 드립 리뉴얼 라벨 기존 라벨 되어다 출고 예정 제품 성분 함량 효능 동일 올리브영 판매 랭킹 신상 랭킹 기획전 이벤트 실시간 랭킹 판매 랭킹 리뷰 베스트 이드 라비 화장솜 증정 올리브영 라인 몰다 더모 판매 랭킹 대한민국 대표 브랜드 대상 미드 라비 토너 리얼 리뷰 처음 사고 벌써 년쩌 중이 수부지 오리 부영 후기 바디 케머 분야 리뷰 바르다 바르다 차이 확실 혜성 사용 후기 피부결 정리 덜머 내다 피부결 대다 느낌 화장솜 적당 루기 메이크업 미크 자다 먹다 피부 추기 메이크업 분야 리뷰 이드 라비 토너 구매 후기 기준 개인 저장 장벽 탄하 빈틈 수분 레이어 화제 자일리톨 클리 세린 밉다 함듀되머 꾸다 주어 완성 스보 수분감 피부 자체 기르다 성분 복합 사과 추출 밉다 오다 이드 비다 라인 버크 개념 수분 공급 시스템 피부 수분 활성화 도록 도와주다 피부 수분 통로 건조 피부 돌투돌 청량하다 사용감 평소 쉬다 건조 느끼다 각질 지르다 깔끔하다 워터 타입 수부지 피부 정돈 싶다 진정 토너 필요 정량 사용감 로션 에센스 끈적임 빠르다 산뜻 실키 탄탄 투명 워터 타입 장점 모으다 촉촉하다 흡수 수분 밀착 마무리 사하 마무리 사하 텍스처 워터 타입 텍스처 타입 텍스쳐 타입 텍스처 타입 텍스처 수분 잠그다 속건조 분광 사하 수분 잠그다 시스템 하루 종일 촉촉하다 수분 장벽 강화 토너 수분 밀착 수분 미백 크림 미백 기능 미백 기능 미백 기능 사용 사용권 몰리 브영 수입 더모 토너 브랜드 바이오 덥다 토너 금액 수량 합산 기준 자사 몰다 판매 금액 기준 대상 기기 측정 개인 차다,1,1,1
